"applicantsCount","applyUrl","benefits/0","companyAddress/addressCountry","companyAddress/addressLocality","companyAddress/addressRegion","companyAddress/postalCode","companyAddress/streetAddress","companyAddress/type","companyDescription","companyEmployeesCount","companyLinkedinUrl","companyLogo","companyName","companySlogan","companyWebsite","descriptionHtml","descriptionText","employmentType","id","industries","inputUrl","jobFunction","jobPosterName","jobPosterPhoto","jobPosterProfileUrl","jobPosterTitle","link","location","postedAt","refId","salary","salaryInfo/0","salaryInfo/1","seniorityLevel","title","trackingId"
"25","https://jobdb.softgarden.de/jobdb/public/jobposting/applyonline/click?jp=56006777","Be an early applicant","DE","Karlsruhe",,"76131","Emmy-Noether-Strasse 9","PostalAddress","Die TechniData IT-Gruppe plant, entwickelt und betreibt IT-Infrastrukturen für mittelständische Unternehmen, Konzerne und öffentliche Auftraggeber. 

TechniData hat sich seit Gründung des „ersten“ TechniData Unternehmens, der TechniData IT-Service GmbH, über den klassischen IT-Dienstleister hinaus entwickelt und ihre Kompetenzen stetig erweitert. Wir verstehen uns heute als IT-Partner und Wegbegleiter unserer Kunden in die Digitalisierung. Dabei ist es unser Ziel, die digitale Transformation für unsere Kunden konkret und erfolgreich umzusetzen. Hierzu zählen die Realisierung von sicheren IoT-Netzen genauso wie die Nutzung von Cloud-Technologien und die Implementierung von digitalen Arbeitsplatz-Lösungen.

Unser Erfolg beruht auf dem Engagement und der fachlichen Qualifikation unserer Mitarbeiter und Mitarbeiterinnen. Technologieexpertise, vereint mit fundiertem Verständnis für das Business und die Prozesse unserer Kunden, ausgeprägte Serviceorientierung und die Arbeit nach hohen Qualitätsnormen, wie der ISO/IEC 27001 und ISO 9001, zeichnen uns aus.

Zahlen & Fakten:
- Gründung: 2005
- Fokusthemen: Cloud, Managed Services, Netzwerk und IT-Security
- Firmensitz: Karlsruhe
- Struktur:
o TechniData IT AG (Holding der TechniData IT-Gruppe)
o TechniData IT-Service GmbH
o TechniData TCC Products GmbH 
o BWG Informationssysteme GmbH
o BWG Medizinsysteme GmbH
o Next Iteration Gesellschaft für Software Engineering mbH
- Umsatz (2024): 60,4 Millionen Euro (in Summe)
- Mitarbeitende (Stand: 31.12.2024): über 360
- Mitarbeitende (1.1.2024): über 350
- www.technidata.de/impressum/

","162","https://de.linkedin.com/company/technidata-it-ag?trk=public_jobs_jserp-result_job-search-card-subtitle","https://media.licdn.com/dms/image/v2/C4D0BAQFv6NlAlUU88A/company-logo_100_100/company-logo_100_100/0/1630462432381/technidata_it_ag_logo?e=1760572800&v=beta&t=_Age8XGInkQvri1PCV4rSViWCCCJlPzigHz9w0Lv5iU","TechniData IT-Gruppe",,"http://www.technidata.de","<strong>Das interessiert Dich<br><br></strong>Bei uns bist Du genau richtig, wenn Du mindestens eine der Fragen mit „Ja“ beantworten würdest:<br><br><ul><li>Die Themen Passwortsicherheit, Virenschutz und regelmäßige Updates sind für Dich das A und O im Umgang mit PC, Smartphone und Co.?</li><li>Du weißt um die Risiken, die von Cyberkriminalität ausgehen und hältst Dich auf dem Laufenden, damit Dir nichts passiert?</li><li>Du ertappst Dich ständig dabei, dass Du Familie und Freunde zu Phishing-Mails, Verschlüsselungstrojanern und Social Engineering aufschlaust und vor Gefahren warnst?<br><br></li></ul><strong>Wir bieten Dir<br><br></strong><ul><li>Die Möglichkeit Dein Duales Studium in den Praxisphasen an unserem Standort in Möglingen zu absolvieren. In den Theoriephasen finden die Vorlesungen an der DHBW Stuttgart statt. </li><li>Ein tolles und großes Ausbildungsteam mit rund 30 Auszubildenden und DHBW-Studierenden, gemeinsamem wöchentlichen Austausch und Ausbildungsevents, wie Azubihütte und Besuch einer IT-Fachmesse. </li><li>Spannende Aufgaben in einer modernen und zukunftssicheren Unternehmensgruppe. </li><li>Wir bilden für den eigenen Bedarf aus und bieten mit einer Übernahme nach erfolgreichem Studium hervorragende Entwicklungsmöglichkeiten. </li><li>Eine Duz-Kultur, flache Hierarchien und schnelle Entscheidungswege. </li><li>Freiraum für eigene Ideen und Entfaltung Deiner Potentiale sowie Möglichkeiten zur Mitgestaltung. </li><li>Gute Work-Life-Balance und gemeinsame Events, z.B. Betriebsausflug und Jahresabschlussfeier. </li><li>Attraktive Ausbildungsvergütung, vermögenswirksame Leistungen und eine Unfallversicherung. </li><li>Individuelle Begleitung von Anfang an, durch eine Willkommensveranstaltung in der ersten Woche und eine gute Ausbildungsbetreuung. <br><br></li></ul><strong>Wir erwarten<br><br></strong><ul><li>Gute fachgebundene oder allgemeine Hochschulreife (v. a. in Mathematik, Physik und Informatik)</li><li>Viel Interesse für Informatik, insbesondere für alle Themen rund um IT-Sicherheit und Netzwerktechnologien</li><li>Verständnis für komplexe technische Zusammenhänge, analytisches Denkvermögen, Freude an Herausforderungen sowie eine lösungsorientierte Herangehensweise</li><li>Bereitschaft ein Grundverständnis für kaufmännische Themen zu entwickeln und „über den Tellerrand“ zu schauen</li><li>Bereits absolvierte Praktika im IT-Bereich sind ein Plus</li><li>Ausgeprägte Teamorientierung, Offenheit, Kommunikationsstärke und Spaß am Umgang mit Menschen (Kunden und Kollegen)</li><li>Hohes Verantwortungsbewusstsein, sinnvolle Gestaltung von Freiräumen sowie Engagement und Eigeninitiative</li><li>Teamgeist und Respekt im Umgang mit anderen Menschen</li></ul>","Das interessiert DichBei uns bist Du genau richtig, wenn Du mindestens eine der Fragen mit „Ja“ beantworten würdest:Die Themen Passwortsicherheit, Virenschutz und regelmäßige Updates sind für Dich das A und O im Umgang mit PC, Smartphone und Co.?Du weißt um die Risiken, die von Cyberkriminalität ausgehen und hältst Dich auf dem Laufenden, damit Dir nichts passiert?Du ertappst Dich ständig dabei, dass Du Familie und Freunde zu Phishing-Mails, Verschlüsselungstrojanern und Social Engineering aufschlaust und vor Gefahren warnst?Wir bieten DirDie Möglichkeit Dein Duales Studium in den Praxisphasen an unserem Standort in Möglingen zu absolvieren. In den Theoriephasen finden die Vorlesungen an der DHBW Stuttgart statt. Ein tolles und großes Ausbildungsteam mit rund 30 Auszubildenden und DHBW-Studierenden, gemeinsamem wöchentlichen Austausch und Ausbildungsevents, wie Azubihütte und Besuch einer IT-Fachmesse. Spannende Aufgaben in einer modernen und zukunftssicheren Unternehmensgruppe. Wir bilden für den eigenen Bedarf aus und bieten mit einer Übernahme nach erfolgreichem Studium hervorragende Entwicklungsmöglichkeiten. Eine Duz-Kultur, flache Hierarchien und schnelle Entscheidungswege. Freiraum für eigene Ideen und Entfaltung Deiner Potentiale sowie Möglichkeiten zur Mitgestaltung. Gute Work-Life-Balance und gemeinsame Events, z.B. Betriebsausflug und Jahresabschlussfeier. Attraktive Ausbildungsvergütung, vermögenswirksame Leistungen und eine Unfallversicherung. Individuelle Begleitung von Anfang an, durch eine Willkommensveranstaltung in der ersten Woche und eine gute Ausbildungsbetreuung. Wir erwartenGute fachgebundene oder allgemeine Hochschulreife (v. a. in Mathematik, Physik und Informatik)Viel Interesse für Informatik, insbesondere für alle Themen rund um IT-Sicherheit und NetzwerktechnologienVerständnis für komplexe technische Zusammenhänge, analytisches Denkvermögen, Freude an Herausforderungen sowie eine lösungsorientierte HerangehensweiseBereitschaft ein Grundverständnis für kaufmännische Themen zu entwickeln und „über den Tellerrand“ zu schauenBereits absolvierte Praktika im IT-Bereich sind ein PlusAusgeprägte Teamorientierung, Offenheit, Kommunikationsstärke und Spaß am Umgang mit Menschen (Kunden und Kollegen)Hohes Verantwortungsbewusstsein, sinnvolle Gestaltung von Freiräumen sowie Engagement und EigeninitiativeTeamgeist und Respekt im Umgang mit anderen Menschen","Full-time","4223055295","IT Services and IT Consulting","https://www.linkedin.com/jobs/search/?currentJobId=4243060808&geoId=101282230&keywords=Cybercrime&origin=JOB_SEARCH_PAGE_SEARCH_BUTTON&refresh=true","Engineering and Information Technology",,,,,"https://de.linkedin.com/jobs/view/dhbw-studium-informatik-mit-studienrichtung-cyber-security-b-sc-w-m-d-ab-2026-at-technidata-it-gruppe-4223055295?refId=kSw2%2BIaxYmaLTy7gPNOyHg%3D%3D&trackingId=wkKtYXq1wPwLD7iDci%2BK6g%3D%3D&position=22&pageNum=0","Möglingen, Baden-Württemberg, Germany","2025-05-07","kSw2+IaxYmaLTy7gPNOyHg==","","",,"Internship","DHBW-Studium Informatik mit Studienrichtung Cyber Security (B.Sc.) (w/m/d) ab 2026","wkKtYXq1wPwLD7iDci+K6g=="
"25","https://jobs.fraunhofer.de/job/Bonn-WISSENSCHAFTLICHER-MITARBEITERIN-Fachrichtung-Botnetzanalyse-53113/884317801/",,"DE","Wachtberg",,"53343","Fraunhoferstr. 20","PostalAddress","Das Fraunhofer-Institut für Kommunikation, Informationsverarbeitung und Ergonomie FKIE hilft, Gefahren aufzuspüren und zu vermeiden. Wir gewinnen, übertragen, verarbeiten und schützen Informationen und stellen sie verständlich dar. Unsere Systeme werden von der Bundeswehr, zivilen Sicherheitseinrichtungen und der Industrie verwendet.

Nahtlose Sicherheitsassistenzsysteme

Die Abwehr von Bedrohungen - etwa durch Terrorismus - ist auf intelligente Lagedarstellungen angewiesen. Fortschrittliche Tracking- und Datenfusionsmethoden werten Daten aus Netzwerken unterschiedlicher Sensoren aus und erhöhen so das Lagebewusstsein. Robotersysteme liefern auch dann noch Daten, wenn Einsätze für Menschen zu gefährlich sind.

Intelligente Systeme zur Entscheidungsunterstützung

Intelligente Systeme zur Entscheidungsunterstützung machen relevante Informationen schnell zugänglich und verteilen fusionierte Informationen konsistent an die richtigen Stellen. Darüber hinaus entwickeln wir Mensch-Maschine-Schnittstellen, die es Menschen ermöglichen, intuitiv und effektiv mit den Systemen zu arbeiten.

Robuste und sichere Kommunikationssysteme

Für moderne Kriseneinsätze entwickeln wir robuste Netze, die selbst bei problematischer Funkausbreitung zuverlässig arbeiten. Zuverlässige Methoden klassifizieren Sender auch unter schwierigen Bedingungen. Die Sicherheit kritischer Netzinfrastrukturen ist Schwerpunkt der Cyber-Defense-Forschung.

Impressum: http://www.fkie.fraunhofer.de/de/impressum.html","286","https://de.linkedin.com/company/fraunhofer-fkie?trk=public_jobs_jserp-result_job-search-card-subtitle","https://media.licdn.com/dms/image/v2/C560BAQHVJg4u0mz3Sg/company-logo_100_100/company-logo_100_100/0/1631331802463?e=1760572800&v=beta&t=eKxGXTlDNG2Hx0Fg8n1MacUSoMNMVFfFv4UpCWGuFAE","Fraunhofer FKIE","Forschung und Technologien für eine sichere Welt","https://www.fkie.fraunhofer.de","Digitalisierung ist einer der Megatrends unserer Zeit. In allen Bereichen unseres Lebens haben digitale Systeme Einzug erhalten, immer raffiniertere Algorithmen werten immer größere Mengen von Daten aus. Gleichzeitig florieren Cyberkriminalität und -spionage. Diese neuartigen Gefahren frühzeitig zu erkennen, zu minimieren und beherrschbar zu machen ist die wohl spannendste Forschungsfrage unserer Zeit. Wissenschaftliche Mitarbeitende aus den Fachbereichen Informatik, Mathematik, Physik und Ingenieurwesen treiben das Thema interdisziplinär voran.<br><br>Glauben auch Sie daran, dass man sich im Cyber- und Informationsraum sicher bewegen können sollte?<br><br>Sie suchen eine Arbeit, bei der Sie inhaltlich Sinnvolles über reines Profitstreben priorisieren können?<br><br>Möchten Sie sich bei einer der internationalen Top-Adressen zum Thema Cybersicherheit zur Fachgröße weiterqualifizieren?<br><br><strong>Dann sind Sie bei uns richtig! Helfen Sie uns die Welt sicherer zu machen!<br><br></strong><strong>Was Sie bei uns tun<br><br></strong>Unser motiviertes Team freut sich darauf mit Ihnen an nationalen und internationalen Forschungsprojekten zu angewandter IT-Sicherheit u.a. in den folgenden Bereichen zu arbeiten:<br><br><ul><li> Analyse und Bekämpfung von Botnetzen und Cyberkriminalität </li><li> Forensische Analyse von Sicherheitsvorfällen </li><li> Schadsoftwareanalyse </li><li> Erkennung und Abwehr von Angriffen gegen Kommunikationsnetze und IT-Systeme </li><li> Erstellung, Test, Analyse und Bewertung von IT-Sicherheitskonzepten und -Produkten <br><br><br></li></ul><strong>Was Sie mitbringen<br><br></strong>Sie sind fasziniert von Technik und haben Ihr wissenschaftliches Hochschulstudium (Diplom oder Master) in Informatik, Wirtschaftsinformatik, Kommunikationstechnik oder einem vergleichbaren Studiengang mit entsprechender Vertiefungsrichtung mit überdurchschnittlichem Erfolg abgeschlossen.<br><br>Sie haben relevante Kenntnisse in mindestens einem der folgenden Bereiche:<br><br><ul><li> Botnetzanalyse und -bekämpfung (insbesondere Sinkholing) </li><li> Angriffserkennung (u.a. mittels Ködersystemen und Intrusion Detection) </li><li> IT-Forensik </li><li> Programmanalyse (insbesondere Schadsoftwareanalyse) </li><li> Analyse von Massendaten <br><br><br></li></ul>Sie verfügen über Kenntnisse u.a. in den Bereichen statische und dynamische Analyse von Binärdateien (bevorzugt mittels IDA Pro) und sind vertraut mit Architekturen und Protokollen für IP-basierte Computernetze. Zudem beherrschen Sie verschiedene Programmiersprachen (bevorzugt C, C++, Java, Python) und sind erfahren im Umgang mit Daten im Bereich mehrerer Terabyte und dafür nötigen Big Data Lösungen (z.B. MongoDB, Hadoop). Mehrjährige Erfahrung im Bereich der Bekämpfung von Cyberkriminalität rundet Ihr Profil ab.<br><br>Sie möchten in unserem jungen, dynamischen Team kreativ, wissenschaftlich und technisch fundiert an anwendungsorientierten Forschungsprojekten sowie bei der Entwicklung und Erprobung experimenteller Anwendungen mitarbeiten. Die Herausforderung komplexe Fragestellungen zu bearbeiten und sie in Software- und Hardwarelösungen umzusetzen nehmen Sie gerne an. Sehr gute Deutsch- und Englischkenntnisse in Wort und Schrift helfen Ihnen Forschungsergebnisse zu dokumentieren und gegenüber Auftraggebern und Forschungspartnern selbstständig zu präsentieren.<br><br><strong>Was Sie erwarten können<br><br></strong><ul><li> Individuelle Entwicklungsmöglichkeiten durch Weiterqualifizierung zum Cybersicherheitsexperten </li><li> Eigeninitiative und Eigenverantwortung durch flache Abteilungshierarchien </li><li> Flexible Arbeitszeiten <br><br><br></li></ul>Wir wertschätzen und fördern die Vielfalt der Kompetenzen unserer Mitarbeitenden und begrüßen daher alle Bewerbungen – unabhängig von Alter, Geschlecht, Nationalität, ethnischer und sozialer Herkunft, Religion, Weltanschauung, Behinderung sowie sexueller Orientierung und Identität. Schwerbehinderte Menschen werden bei gleicher Eignung bevorzugt eingestellt.<br><br>Die Stelle ist zunächst auf 2 Jahre befristet. Die wöchentliche Arbeitszeit beträgt 39 Stunden. Die Stelle kann auch in Teilzeit besetzt werden. Anstellung, Vergütung und Sozialleistungen basieren auf dem Tarifvertrag für den öffentlichen Dienst (TVöD). Zusätzlich kann Fraunhofer leistungs- und erfolgsabhängige variable Vergütungsbestandteile gewähren.<br><br>Mit ihrer Fokussierung auf zukunftsrelevante Schlüsseltechnologien sowie auf die Verwertung der Ergebnisse in Wirtschaft und Industrie spielt die Fraunhofer-Gesellschaft eine zentrale Rolle im Innovationsprozess. Als Wegweiser und Impulsgeber für innovative Entwicklungen und wissenschaftliche Exzellenz wirkt sie mit an der Gestaltung unserer Gesellschaft und unserer Zukunft.<br><br><strong>Haben wir Ihr Interesse geweckt? Dann bewerben Sie sich jetzt online mit Ihren aussagekräftigen Bewerbungsunterlagen. Wir freuen uns darauf, Sie kennenzulernen!<br><br></strong>Fragen zu dieser Postition beantwortet gerne:<br><br>Herr Prof. Dr. Padilla<br><br>Tel.: +49 228 50212-595<br><br>Fraunhofer-Institut für Kommunikation, Informationsverarbeitung und Ergonomie FKIE<br><br>www.fkie.fraunhofer.de<br><br>Kennziffer: 61981 Bewerbungsfrist:","Digitalisierung ist einer der Megatrends unserer Zeit. In allen Bereichen unseres Lebens haben digitale Systeme Einzug erhalten, immer raffiniertere Algorithmen werten immer größere Mengen von Daten aus. Gleichzeitig florieren Cyberkriminalität und -spionage. Diese neuartigen Gefahren frühzeitig zu erkennen, zu minimieren und beherrschbar zu machen ist die wohl spannendste Forschungsfrage unserer Zeit. Wissenschaftliche Mitarbeitende aus den Fachbereichen Informatik, Mathematik, Physik und Ingenieurwesen treiben das Thema interdisziplinär voran.Glauben auch Sie daran, dass man sich im Cyber- und Informationsraum sicher bewegen können sollte?Sie suchen eine Arbeit, bei der Sie inhaltlich Sinnvolles über reines Profitstreben priorisieren können?Möchten Sie sich bei einer der internationalen Top-Adressen zum Thema Cybersicherheit zur Fachgröße weiterqualifizieren?Dann sind Sie bei uns richtig! Helfen Sie uns die Welt sicherer zu machen!Was Sie bei uns tunUnser motiviertes Team freut sich darauf mit Ihnen an nationalen und internationalen Forschungsprojekten zu angewandter IT-Sicherheit u.a. in den folgenden Bereichen zu arbeiten: Analyse und Bekämpfung von Botnetzen und Cyberkriminalität  Forensische Analyse von Sicherheitsvorfällen  Schadsoftwareanalyse  Erkennung und Abwehr von Angriffen gegen Kommunikationsnetze und IT-Systeme  Erstellung, Test, Analyse und Bewertung von IT-Sicherheitskonzepten und -Produkten Was Sie mitbringenSie sind fasziniert von Technik und haben Ihr wissenschaftliches Hochschulstudium (Diplom oder Master) in Informatik, Wirtschaftsinformatik, Kommunikationstechnik oder einem vergleichbaren Studiengang mit entsprechender Vertiefungsrichtung mit überdurchschnittlichem Erfolg abgeschlossen.Sie haben relevante Kenntnisse in mindestens einem der folgenden Bereiche: Botnetzanalyse und -bekämpfung (insbesondere Sinkholing)  Angriffserkennung (u.a. mittels Ködersystemen und Intrusion Detection)  IT-Forensik  Programmanalyse (insbesondere Schadsoftwareanalyse)  Analyse von Massendaten Sie verfügen über Kenntnisse u.a. in den Bereichen statische und dynamische Analyse von Binärdateien (bevorzugt mittels IDA Pro) und sind vertraut mit Architekturen und Protokollen für IP-basierte Computernetze. Zudem beherrschen Sie verschiedene Programmiersprachen (bevorzugt C, C++, Java, Python) und sind erfahren im Umgang mit Daten im Bereich mehrerer Terabyte und dafür nötigen Big Data Lösungen (z.B. MongoDB, Hadoop). Mehrjährige Erfahrung im Bereich der Bekämpfung von Cyberkriminalität rundet Ihr Profil ab.Sie möchten in unserem jungen, dynamischen Team kreativ, wissenschaftlich und technisch fundiert an anwendungsorientierten Forschungsprojekten sowie bei der Entwicklung und Erprobung experimenteller Anwendungen mitarbeiten. Die Herausforderung komplexe Fragestellungen zu bearbeiten und sie in Software- und Hardwarelösungen umzusetzen nehmen Sie gerne an. Sehr gute Deutsch- und Englischkenntnisse in Wort und Schrift helfen Ihnen Forschungsergebnisse zu dokumentieren und gegenüber Auftraggebern und Forschungspartnern selbstständig zu präsentieren.Was Sie erwarten können Individuelle Entwicklungsmöglichkeiten durch Weiterqualifizierung zum Cybersicherheitsexperten  Eigeninitiative und Eigenverantwortung durch flache Abteilungshierarchien  Flexible Arbeitszeiten Wir wertschätzen und fördern die Vielfalt der Kompetenzen unserer Mitarbeitenden und begrüßen daher alle Bewerbungen – unabhängig von Alter, Geschlecht, Nationalität, ethnischer und sozialer Herkunft, Religion, Weltanschauung, Behinderung sowie sexueller Orientierung und Identität. Schwerbehinderte Menschen werden bei gleicher Eignung bevorzugt eingestellt.Die Stelle ist zunächst auf 2 Jahre befristet. Die wöchentliche Arbeitszeit beträgt 39 Stunden. Die Stelle kann auch in Teilzeit besetzt werden. Anstellung, Vergütung und Sozialleistungen basieren auf dem Tarifvertrag für den öffentlichen Dienst (TVöD). Zusätzlich kann Fraunhofer leistungs- und erfolgsabhängige variable Vergütungsbestandteile gewähren.Mit ihrer Fokussierung auf zukunftsrelevante Schlüsseltechnologien sowie auf die Verwertung der Ergebnisse in Wirtschaft und Industrie spielt die Fraunhofer-Gesellschaft eine zentrale Rolle im Innovationsprozess. Als Wegweiser und Impulsgeber für innovative Entwicklungen und wissenschaftliche Exzellenz wirkt sie mit an der Gestaltung unserer Gesellschaft und unserer Zukunft.Haben wir Ihr Interesse geweckt? Dann bewerben Sie sich jetzt online mit Ihren aussagekräftigen Bewerbungsunterlagen. Wir freuen uns darauf, Sie kennenzulernen!Fragen zu dieser Postition beantwortet gerne:Herr Prof. Dr. PadillaTel.: +49 228 50212-595Fraunhofer-Institut für Kommunikation, Informationsverarbeitung und Ergonomie FKIEwww.fkie.fraunhofer.deKennziffer: 61981 Bewerbungsfrist:","Full-time","3828609145","Research","https://www.linkedin.com/jobs/search/?currentJobId=4243060808&geoId=101282230&keywords=Cybercrime&origin=JOB_SEARCH_PAGE_SEARCH_BUTTON&refresh=true","Research, Analyst, and Information Technology",,,,,"https://de.linkedin.com/jobs/view/wissenschaftliche-r-mitarbeiter-in-fachrichtung-botnetzanalyse-at-fraunhofer-fkie-3828609145?refId=kSw2%2BIaxYmaLTy7gPNOyHg%3D%3D&trackingId=mD6rIwRlwFHKiraMezj0kw%3D%3D&position=23&pageNum=0","Bonn, North Rhine-Westphalia, Germany","2024-01-18","kSw2+IaxYmaLTy7gPNOyHg==","","",,"Entry level","WISSENSCHAFTLICHE*R MITARBEITER*IN - Fachrichtung Botnetzanalyse","mD6rIwRlwFHKiraMezj0kw=="
