"applicantsCount","applyUrl","benefits/0","companyAddress/addressCountry","companyAddress/addressLocality","companyAddress/addressRegion","companyAddress/postalCode","companyAddress/streetAddress","companyAddress/type","companyDescription","companyEmployeesCount","companyLinkedinUrl","companyLogo","companyName","companySlogan","companyWebsite","descriptionHtml","descriptionText","employmentType","id","industries","inputUrl","jobFunction","jobPosterName","jobPosterPhoto","jobPosterProfileUrl","jobPosterTitle","link","location","postedAt","refId","salary","salaryInfo/0","salaryInfo/1","seniorityLevel","title","trackingId"
"25","","Be an early applicant","SG","Singapore","Central","068900","108 Robinson Road","PostalAddress","Founded in 2003 and headquartered in Singapore, Group-IB is a leading creator of cybersecurity technologies to investigate, prevent, and fight digital crime. Combating cybercrime is in the company’s DNA, shaping its technological capabilities to defend businesses, citizens, and support law enforcement operations.

Group-IB’s Digital Crime Resistance Centers (DCRCs) are located in the Middle East, Europe, and Asia-Pacific to help critically analyze and promptly mitigate regional and country-specific threats. These mission-critical units help Group-IB strengthen its contribution to global cybercrime prevention and continually expand its threat-hunting capabilities.

Group-IB’s decentralized and autonomous operational structure helps it offer tailored, comprehensive support services with a high level of expertise. We map and mitigate adversaries' tactics in each region, delivering customized cybersecurity solutions tailored to risk profiles and requirements of various industries, including retail, healthcare, gaming, financial services, manufacturing, critical services, and more.

Furthermore, Group-IB's full-cycle incident response and investigation have consistently elevated industry standards. With over 70,000+ hours dedicated to countering threats, our research serves as an industry compass. 

Its solutions and services have time and again been revered by leading advisory and analyst agencies such as Aite Novarica, Forrester, Frost & Sullivan, KuppingerCole Analysts AG, and more.

Being an active partner in global investigations, Group-IB collaborates with international law enforcement organizations such as INTERPOL and EUROPOL to create a safer cyberspace.

Follow Group-IB on Twitter: https://twitter.com/GroupIB

Follow Group-IB on Instagram: https://instagram.com/groupibhq

Follow Group-IB on Facebook: https://www.facebook.com/groupibHQ

Follow Group-IB on Telegram: https://t.me/Group_IB","411","https://sg.linkedin.com/company/group-ib?trk=public_jobs_jserp-result_job-search-card-subtitle","https://media.licdn.com/dms/image/v2/C560BAQGc3U-nGTAAjg/company-logo_100_100/company-logo_100_100/0/1638435579075/group_ib_logo?e=1760572800&v=beta&t=uR5fmiNqratC7NQMAS9EFF6SoZR69__32M5au_tIMnM","Group-IB","Global Threat Hunting and Adversary-Centric Cyber Intelligence Company","https://www.group-ib.com","<p><strong>About Group-IB</strong></p><p><br></p><p>Founded in 2003 and headquartered in Singapore, Group-IB is a leading creator of cybersecurity technologies to investigate, prevent, and fight digital crime. Combating cybercrime is in the company’s DNA, shaping its technological capabilities to defend businesses and citizens and support law enforcement operations.</p><p>Group-IB’s Digital Crime Resistance Centers (DCRCs) are located in the Middle East, Europe, Central Asia, and Asia-Pacific to help critically analyze and promptly mitigate regional and country-specific threats. These mission-critical units help Group-IB strengthen its contribution to global cybercrime prevention and continually expand its threat-hunting capabilities.</p><p>Each of us can help make the world a safer place. <strong>Join us!</strong></p><p><br></p><p><strong>The role: </strong></p><p>Our Pre-Sales Managers are primarily technical experts whose depth of knowledge reflects the expertise of the entire Group-IB team. This role focuses on our business in Germany, Austria and Switzerland and involves close collaboration with our local representatives.</p><p><br></p><p><strong>Tasks to solve:</strong></p><p><br></p><ul><li>Build strategic relationships with various internal teams (field sales, channel partners, other pre-sales, engineering, marketing) to effectively generate and manage business activities. </li><li>Participate in pre-sales activities including but not limited to conducting Proof of Concepts (PoC), scoping and architecting solutions (HLD, LLD), building Bills of Quantities (BOQ), delivering product-specific presentations, and providing technical training and seminars for channel partners and customers. </li><li>Provide strong customer engagement as a trusted advisor to understand technical and business objectives and align them with Group-IB products and services. </li><li>Set and manage customer expectations regarding product and service deliverables. </li><li>Own and develop relationships with key technical decision-makers and influencers within target customers, including presenting and articulating our value proposition at all organizational levels, including C-level executives. </li><li>Prepare project documentation and support the sales proposal process by responding to complex RFIs and RFPs. </li><li>Develop product implementation architectures in collaboration with customers. </li><li>Manage and control pre-sales projects and activities. </li><li>Ensure solution functionality during PoCs and subscription phases by aligning with customer use cases, success criteria, integration requirements, and providing partial post-sales support. </li><li>Become a true expert on Group-IB solutions to best qualify potential sales opportunities.</li></ul><p><br></p><p><strong>Qualifications:</strong></p><p><br></p><ul><li>Minimum of <strong>5 years of experience in information security pre-sales,</strong> solution engineering, sales engineering, or architecture roles. </li><li>Customer-focused mindset with the ability to take ownership, lead initiatives, and collaborate with cross-functional teams including customer success, professional services, product management, sales, and engineering. </li><li>Strong analytical, communication, and presentation skills. </li><li>Passion for cybersecurity and high-tech technologies with hands-on knowledge of information security threats, vulnerabilities, protection technologies, botnets, malware types, etc. </li><li>Solid practical knowledge of networking technologies and concepts (routing &amp; switching, communication protocols, DNS, DHCP, IP, OSI/ISO, email systems, SSL, VPN, SPAN, GRE, VLAN, etc.). </li><li>Familiarity with NIST and MITRE ATT&amp;CK frameworks. </li><li>Advanced technical skills across a broad range of cybersecurity products (Email Protection, Sandbox, AV/EDR, NDR, XDR, Threat Intelligence, Fraud Protection). </li><li>Strong market awareness of information and cybersecurity vendors and technologies. </li><li>Understanding of cybersecurity principles and enterprise-level security technologies. </li><li><strong>Fluency in German and English (both written and spoken) are mandatory.</strong></li></ul><p><br></p><p><strong>Why GROUP-IB? </strong></p><p><br></p><ul><li><strong>Your happiness is important to us: </strong>We want every single team member to be happy.</li><li><strong>Continuing professional development:</strong> At Group-IB, you can choose from various paths to growth: progress as an expert, advance to a management position, try your hand in another department, relocate abroad, or launch a new business area.</li><li><strong>Group-IB.A team with extensive international </strong>expertise: Do you have experience but are looking for exciting challenges? By choosing us, you will be choosing complex tasks and continuously improving your skills in a fast-growing international<strong> </strong>company<strong>.</strong></li><li><strong>Globally recognized tec</strong>hnologies: Group-IB's members are located in 25 countries, and our products and services are sold in 60 countries. What’s more, Gartner, IDC, and Forrester have ranked our technologies among the best in their class. We work with over 450 international partners and about 500 clients<strong>.</strong></li><li><strong>A culture created by each of us:</strong> Group-IB’s employees speak many different languages and understand one another. We respect each other's beliefs, share common values, and strive toward the happiness of every employee<strong>.</strong></li><li><strong>Economic stability: </strong>Group-IB's sustainable growth helps rapidly develop careers that would take years to progress as far as most other companies.</li></ul><p><br></p><p><strong>What else should you know: </strong></p><p><br></p><ul><li><strong>Flexible schedule: </strong>Group-IB does not have fixed working hours. You choose your schedule. We adhere to the principle advocated by Steve Jobs: “We have to work not 12 hours and head. ”Health: If anything goes wrong, don’t worry — we offer health insurance.</li><li><strong>Certificates and training courses</strong>: Group-IB specialists hold over 1,000 professional certificates, including CEH, CISSP, OSCP, GIAC, MCFE, BSI, as well as some rare ones that would be a source of pride for experts in forensics, penetration testing, and reverse engineering worldwide. We have an incentive program that helps employees achieve certifications at the company's expense.</li><li><strong>Challenges:</strong> A wide selection of GIB programs helps you improve soft skills, gain new competencies, and receive monetary rewards.</li><li><strong>The initiative is rewarded: </strong>At Group-IB, you can bring your most daring ideas to life. The company encourages technical blogging, writing articles, building sports teams, and other creative activities.</li></ul><p></p>","About Group-IBFounded in 2003 and headquartered in Singapore, Group-IB is a leading creator of cybersecurity technologies to investigate, prevent, and fight digital crime. Combating cybercrime is in the company’s DNA, shaping its technological capabilities to defend businesses and citizens and support law enforcement operations.Group-IB’s Digital Crime Resistance Centers (DCRCs) are located in the Middle East, Europe, Central Asia, and Asia-Pacific to help critically analyze and promptly mitigate regional and country-specific threats. These mission-critical units help Group-IB strengthen its contribution to global cybercrime prevention and continually expand its threat-hunting capabilities.Each of us can help make the world a safer place. Join us!The role: Our Pre-Sales Managers are primarily technical experts whose depth of knowledge reflects the expertise of the entire Group-IB team. This role focuses on our business in Germany, Austria and Switzerland and involves close collaboration with our local representatives.Tasks to solve:Build strategic relationships with various internal teams (field sales, channel partners, other pre-sales, engineering, marketing) to effectively generate and manage business activities. Participate in pre-sales activities including but not limited to conducting Proof of Concepts (PoC), scoping and architecting solutions (HLD, LLD), building Bills of Quantities (BOQ), delivering product-specific presentations, and providing technical training and seminars for channel partners and customers. Provide strong customer engagement as a trusted advisor to understand technical and business objectives and align them with Group-IB products and services. Set and manage customer expectations regarding product and service deliverables. Own and develop relationships with key technical decision-makers and influencers within target customers, including presenting and articulating our value proposition at all organizational levels, including C-level executives. Prepare project documentation and support the sales proposal process by responding to complex RFIs and RFPs. Develop product implementation architectures in collaboration with customers. Manage and control pre-sales projects and activities. Ensure solution functionality during PoCs and subscription phases by aligning with customer use cases, success criteria, integration requirements, and providing partial post-sales support. Become a true expert on Group-IB solutions to best qualify potential sales opportunities.Qualifications:Minimum of 5 years of experience in information security pre-sales, solution engineering, sales engineering, or architecture roles. Customer-focused mindset with the ability to take ownership, lead initiatives, and collaborate with cross-functional teams including customer success, professional services, product management, sales, and engineering. Strong analytical, communication, and presentation skills. Passion for cybersecurity and high-tech technologies with hands-on knowledge of information security threats, vulnerabilities, protection technologies, botnets, malware types, etc. Solid practical knowledge of networking technologies and concepts (routing &amp; switching, communication protocols, DNS, DHCP, IP, OSI/ISO, email systems, SSL, VPN, SPAN, GRE, VLAN, etc.). Familiarity with NIST and MITRE ATT&amp;CK frameworks. Advanced technical skills across a broad range of cybersecurity products (Email Protection, Sandbox, AV/EDR, NDR, XDR, Threat Intelligence, Fraud Protection). Strong market awareness of information and cybersecurity vendors and technologies. Understanding of cybersecurity principles and enterprise-level security technologies. Fluency in German and English (both written and spoken) are mandatory.Why GROUP-IB? Your happiness is important to us: We want every single team member to be happy.Continuing professional development: At Group-IB, you can choose from various paths to growth: progress as an expert, advance to a management position, try your hand in another department, relocate abroad, or launch a new business area.Group-IB.A team with extensive international expertise: Do you have experience but are looking for exciting challenges? By choosing us, you will be choosing complex tasks and continuously improving your skills in a fast-growing international company.Globally recognized technologies: Group-IB's members are located in 25 countries, and our products and services are sold in 60 countries. What’s more, Gartner, IDC, and Forrester have ranked our technologies among the best in their class. We work with over 450 international partners and about 500 clients.A culture created by each of us: Group-IB’s employees speak many different languages and understand one another. We respect each other's beliefs, share common values, and strive toward the happiness of every employee.Economic stability: Group-IB's sustainable growth helps rapidly develop careers that would take years to progress as far as most other companies.What else should you know: Flexible schedule: Group-IB does not have fixed working hours. You choose your schedule. We adhere to the principle advocated by Steve Jobs: “We have to work not 12 hours and head. ”Health: If anything goes wrong, don’t worry — we offer health insurance.Certificates and training courses: Group-IB specialists hold over 1,000 professional certificates, including CEH, CISSP, OSCP, GIAC, MCFE, BSI, as well as some rare ones that would be a source of pride for experts in forensics, penetration testing, and reverse engineering worldwide. We have an incentive program that helps employees achieve certifications at the company's expense.Challenges: A wide selection of GIB programs helps you improve soft skills, gain new competencies, and receive monetary rewards.The initiative is rewarded: At Group-IB, you can bring your most daring ideas to life. The company encourages technical blogging, writing articles, building sports teams, and other creative activities.","Full-time","4289636691","Computer and Network Security","https://www.linkedin.com/jobs/search/?currentJobId=4243060808&geoId=101282230&keywords=Cybercrime&origin=JOB_SEARCH_PAGE_SEARCH_BUTTON&refresh=true","Sales and Engineering",,,,,"https://de.linkedin.com/jobs/view/senior-pre-sales-manager-german-speaker-at-group-ib-4289636691?refId=Ud8RG6MlqZsaYGEzSRlhmg%3D%3D&trackingId=yc9gMwqd4N4oY4viTZfz%2Bw%3D%3D&position=15&pageNum=1","Germany","2025-08-26","Ud8RG6MlqZsaYGEzSRlhmg==","","",,"Mid-Senior level","Senior Pre-sales Manager - German speaker","yc9gMwqd4N4oY4viTZfz+w=="
