"applicantsCount","applyUrl","benefits/0","companyAddress/addressCountry","companyAddress/addressLocality","companyAddress/addressRegion","companyAddress/postalCode","companyAddress/streetAddress","companyAddress/type","companyDescription","companyEmployeesCount","companyLinkedinUrl","companyLogo","companyName","companySlogan","companyWebsite","descriptionHtml","descriptionText","employmentType","id","industries","inputUrl","jobFunction","jobPosterName","jobPosterPhoto","jobPosterProfileUrl","jobPosterTitle","link","location","postedAt","refId","salary","salaryInfo/0","salaryInfo/1","seniorityLevel","title","trackingId"
"25","https://jobs.lever.co/yuno/8badf24f-da5b-491c-994f-209b48f8e6a1/apply?lever-source=LinkedIn&source=LinkedIn","Be an early applicant","US","New  York ",,,,"PostalAddress","Yuno is a leading global payment orchestration platform. We empower businesses to simplify their payment operations, maximize revenue, and accelerate global expansion. 

Yuno connects your business to over 1,000 global payment methods through a single API integration. Our Smart Routing tools use advanced algorithms to optimize the flow of transactions through various payment providers, maximizing acceptance rates while also reducing processing costs. Our wide selection of fraud prevention providers and advanced tokenization capabilities help reduce the risk of fraud and minimize transaction declines.

Yuno is the payment orchestration solution of choice for high-performing payments teams. We support some of the world’s leading brands, including McDonald’s, Rappi, Viva Aerobus, InDrive and other businesses across more than 80 countries.

Yuno was founded in 2022 and is led by former payments and technology executives from Rappi, Uber, Ali Pay and other leading companies. Yuno is backed by a consortium of high-profile investors, including DST Global Partners, Andreessen Horowitz, Tiger Global, Kaszek Ventures, and Monashees.","989","https://www.linkedin.com/company/yunopay?trk=public_jobs_jserp-result_job-search-card-subtitle","https://media.licdn.com/dms/image/v2/D560BAQGe-nlKrCnIpg/company-logo_100_100/B56Zcy8UdyHoAU-/0/1748906363071/yunopay_logo?e=1760572800&v=beta&t=Hpg1C7eZIZqMqx7pB45OyUQBBNr_n7hPkP50kFXhhss","Yuno","Yuno is a financial infrastructure platform that simplifies global payments for enterprise merchants around the world.","https://y.uno/","Remote, Sweden, Full-Time, Individual Contributor<br><br>🟣 Who We Are<br><br>Yuno enables any company to accept all available payment methods and manage fraud detection and prevention through a single integration. Our strength is in our people, founded by a team of experts in the payments and IT industries.<br><br>Yuno has built a high-performance payment orchestrator. Our technology gives companies access to top payment capabilities, allowing them to engage customers confidently and manage global business operations seamlessly.<br><br>Interested in joining a fast-growing fintech company? Keep on reading and discover how your future will be with Yuno.<br><br>🟣 Shape your future with Yuno!<br><br>We are orchestrating the best high-performing team!<br><br>If you are a Business Development Manager ambitious and passionate about innovation, joining Yuno will allow you to transform your passion into real high-impact solutions. At Yuno, every role impacts the payment revolution.<br><br>🟣 How Yuno will challenge you<br><br><ul><li>Actively seeking out and targeting business clients who can benefit from the company's payment solutions</li><li>Own the full sales cycle with enterprise merchant - from the prospecting/lead stage to closing deals and onboarding them;</li><li>Constantly learning and researching the payments market to understand the needs, opportunities, and trends in the sector</li><li>Developing tailored strategies for approaching and engaging with potential clients</li><li>Establishing and maintaining relationships with key business clients and industry partners</li><li>Leading complex negotiations with enterprise merchants and closing deals, focusing on long-term mutually beneficial agreements</li><li>Effectively presenting and explaining Yunos's solution to prospects</li><li>Gathering client feedback to improve the product and service offerings</li><li>Working closely with other departments like marketing, product development, and customer service to ensure a cohesive approach to B2B sales</li><li>Keeping track of sales targets and providing regular reports on progress and challenges to management<br><br><br></li></ul>🟣 The skills you need<br><br><ul><li> Minimum of 5 years of proven experience in a hunter and closer role, with a strong track record in complex SaaS solutions</li><li> Mandatory advanced English and native Swedish</li><li> Demonstrable sales track record, particularly in international and multi-cultural contexts</li><li> Familiarity with customer support practices</li><li> Proficiency in MS Office, CRM software (e.g.,Salesforce)</li><li> In-depth market knowledge, with an emphasis on payment sectors</li><li> Exceptional communication, negotiation, and rapport-building skills</li><li> Effective time management and strategic planning abilities</li><li> BSc/BA in Business Administration, Sales, or a related field</li><li> Proven self-driven mindset with the ability to thrive in fast-paced startup environments</li><li> Experience in payments or fintech is a strong plus<br><br><br></li></ul>🟣 What Yuno offers you<br><br><ul><li>Competitive compensation</li><li>Remote work - You can work from anywhere!</li><li>Home office bonus - We offer a one-time allowance to help you create your ideal home office</li><li>Work equipment</li><li>Stock options</li><li>Health Plan, no matter where you are</li><li>Flexible Days off</li><li>Language, professional, and personal growth courses<br></li></ul>","Remote, Sweden, Full-Time, Individual Contributor🟣 Who We AreYuno enables any company to accept all available payment methods and manage fraud detection and prevention through a single integration. Our strength is in our people, founded by a team of experts in the payments and IT industries.Yuno has built a high-performance payment orchestrator. Our technology gives companies access to top payment capabilities, allowing them to engage customers confidently and manage global business operations seamlessly.Interested in joining a fast-growing fintech company? Keep on reading and discover how your future will be with Yuno.🟣 Shape your future with Yuno!We are orchestrating the best high-performing team!If you are a Business Development Manager ambitious and passionate about innovation, joining Yuno will allow you to transform your passion into real high-impact solutions. At Yuno, every role impacts the payment revolution.🟣 How Yuno will challenge youActively seeking out and targeting business clients who can benefit from the company's payment solutionsOwn the full sales cycle with enterprise merchant - from the prospecting/lead stage to closing deals and onboarding them;Constantly learning and researching the payments market to understand the needs, opportunities, and trends in the sectorDeveloping tailored strategies for approaching and engaging with potential clientsEstablishing and maintaining relationships with key business clients and industry partnersLeading complex negotiations with enterprise merchants and closing deals, focusing on long-term mutually beneficial agreementsEffectively presenting and explaining Yunos's solution to prospectsGathering client feedback to improve the product and service offeringsWorking closely with other departments like marketing, product development, and customer service to ensure a cohesive approach to B2B salesKeeping track of sales targets and providing regular reports on progress and challenges to management🟣 The skills you need Minimum of 5 years of proven experience in a hunter and closer role, with a strong track record in complex SaaS solutions Mandatory advanced English and native Swedish Demonstrable sales track record, particularly in international and multi-cultural contexts Familiarity with customer support practices Proficiency in MS Office, CRM software (e.g.,Salesforce) In-depth market knowledge, with an emphasis on payment sectors Exceptional communication, negotiation, and rapport-building skills Effective time management and strategic planning abilities BSc/BA in Business Administration, Sales, or a related field Proven self-driven mindset with the ability to thrive in fast-paced startup environments Experience in payments or fintech is a strong plus🟣 What Yuno offers youCompetitive compensationRemote work - You can work from anywhere!Home office bonus - We offer a one-time allowance to help you create your ideal home officeWork equipmentStock optionsHealth Plan, no matter where you areFlexible Days offLanguage, professional, and personal growth courses","Full-time","4280988973","Financial Services","https://www.linkedin.com/jobs/search/?currentJobId=4289763903&geoId=105117694&keywords=fraud%20detection&origin=JOB_SEARCH_PAGE_SEARCH_BUTTON&refresh=true","Sales and Business Development",,,,,"https://se.linkedin.com/jobs/view/sr-sales-executive-swedish-speaking-at-yuno-4280988973?refId=wKFzMIXN2KX79fsVEFx7Kw%3D%3D&trackingId=s632lzsp3MQyVquFyMoG2w%3D%3D&position=18&pageNum=0","Greater Gothenburg Metropolitan Area","2025-08-06","wKFzMIXN2KX79fsVEFx7Kw==","","",,"Not Applicable","SR Sales Executive (Swedish Speaking)","s632lzsp3MQyVquFyMoG2w=="
"136","https://jobs.lever.co/spotify/e5aa00ed-e5f8-4b37-9030-2e4a113ad755?lever-source=LinkedInJobs",,"SE","Stockholm","Stockholm County",,"Regeringsgatan 19","PostalAddress","Our mission is to unlock the potential of human creativity—by giving a million creative artists the opportunity to live off their art and billions of fans the opportunity to enjoy and be inspired by it.
 
Spotify transformed music listening forever when it launched in Sweden in 2008. Discover, manage and share over 70m tracks for free, or upgrade to Spotify Premium to access exclusive features including offline mode, improved sound quality, and an ad-free music listening experience. 

Today, Spotify is the most popular global audio streaming service with 365m users, including 165m subscribers across 178 markets. We are the largest driver of revenue to the music business today.","17190","https://se.linkedin.com/company/spotify?trk=public_jobs_jserp-result_job-search-card-subtitle","https://media.licdn.com/dms/image/v2/C560BAQFkDzx_7dqq3A/company-logo_100_100/company-logo_100_100/0/1631377935713?e=1760572800&v=beta&t=P1ZEr_PWhTvEjrUAzeOFTZqRlPr7zGOGKecxOLd9tL8","Spotify","Passionate music fans. Innovative tech pros. Perfect harmony. Join our band.","http://www.lifeatspotify.com","Are you ready to shape the future of developer experience at global scale? We’re seeking a skilled Senior Growth Marketing Manager to lead our digital marketing initiatives and drive significant growth for our developer portal, Backstage. In this role, you will be responsible for managing and optimizing our digital marketing channels, including paid search, social media, and display advertising. You will develop growth strategies, forecast and report on campaign performance, and work closely with other marketing leaders to align growth efforts with broader company objectives. This position requires an analytical mindset, a flair for creativity, and a proven track record in driving successful digital marketing campaigns.<br><br>Backstage is more than just a platform—it’s a ground-breaking force in the developer community. Originally built at Spotify, Backstage has become the gold standard for developer portals, now powering the internal platforms of startups and Fortune 500s alike. It brings clarity to complexity, helping teams build software faster, safer, and with greater autonomy. As part of the Backstage GTM team, you’ll help shape the future of developer experience for our global customers, our open-source community, and Spotify. You’ll join a team that’s passionate about open ecosystems, obsessed with quality, and focused on impact - delivering tools that developers love and rely on every day.<br><br>What You'll Do<br><br><ul><li>Design, develop and implement robust paid acquisition campaigns across multiple channels (search, social, influencer, programmatic, emerging formats) to drive high-quality user growth.</li><li>Plan, implement, and optimize media buys with a focus on efficiency.</li><li>Manage and optimize performance of digital marketing channels.</li><li>Oversee ad unit development, testing, and analysis for continuous improvement.</li><li>Forecast, measure, and analyze digital campaign performance across the funnel.</li><li>Test and scale new channels (ABM platforms, sponsored content, industry-specific ad networks) to expand reach.</li><li>Refine our attribution models, marketing tech stack, and processes to ensure we’re always optimizing for maximum impact.</li><li>Collaborate with sales and product teams to improve conversion rates. </li><li>Build AI-first creative systems to rapidly prototype and test high-performing assets.<br><br></li></ul>Who You Are<br><br><ul><li>You have 5+ years of experience in growth marketing and performance marketing, ideally in B2B SaaS for high-growth tech.</li><li>You have a proven ability to launch, scale, and optimize paid channels.</li><li>You have expertise in Paid Search, Paid Social, Display, Retargeting, Affiliate, CRO, and SEO.</li><li>You are familiar with acquisition analysis, A/B testing, and ad fraud detection.</li><li>You have an analytical mindset with strong attention to detail.</li><li>You have up-to-date knowledge of B2B performance marketing standards and trends.</li><li>You are a strong communicator and enjoy working cross-functionally with technical teams and stakeholders.</li><li>You have a bachelor’s degree in marketing, business, or a related field.<br><br></li></ul>Where You'll Be<br><br><ul><li>This role is based in London (UK) or Stockholm (Sweden).</li><li>We offer you the flexibility to work where you work best! There will be some in person meetings, but still allows for flexibility to work from home.<br><br></li></ul>Spotify is an equal opportunity employer. You are welcome at Spotify for who you are, no matter where you come from, what you look like, or what’s playing in your headphones. Our platform is for everyone, and so is our workplace. The more voices we have represented and amplified in our business, the more we will all thrive, contribute, and be forward-thinking! So bring us your personal experience, your perspectives, and your background. It’s in our differences that we will find the power to keep revolutionizing the way the world listens.<br><br>At Spotify, we are passionate about inclusivity and making sure our entire recruitment process is accessible to everyone. We have ways to request reasonable accommodations during the interview process and help assist in what you need. If you need accommodations at any stage of the application or interview process, please let us know - we’re here to support you in any way we can.<br><br>Spotify transformed music listening forever when we launched in 2008. Our mission is to unlock the potential of human creativity by giving a million creative artists the opportunity to live off their art and billions of fans the chance to enjoy and be passionate about these creators. Everything we do is driven by our love for music and podcasting. Today, we are the world’s most popular audio streaming subscription service.","Are you ready to shape the future of developer experience at global scale? We’re seeking a skilled Senior Growth Marketing Manager to lead our digital marketing initiatives and drive significant growth for our developer portal, Backstage. In this role, you will be responsible for managing and optimizing our digital marketing channels, including paid search, social media, and display advertising. You will develop growth strategies, forecast and report on campaign performance, and work closely with other marketing leaders to align growth efforts with broader company objectives. This position requires an analytical mindset, a flair for creativity, and a proven track record in driving successful digital marketing campaigns.Backstage is more than just a platform—it’s a ground-breaking force in the developer community. Originally built at Spotify, Backstage has become the gold standard for developer portals, now powering the internal platforms of startups and Fortune 500s alike. It brings clarity to complexity, helping teams build software faster, safer, and with greater autonomy. As part of the Backstage GTM team, you’ll help shape the future of developer experience for our global customers, our open-source community, and Spotify. You’ll join a team that’s passionate about open ecosystems, obsessed with quality, and focused on impact - delivering tools that developers love and rely on every day.What You'll DoDesign, develop and implement robust paid acquisition campaigns across multiple channels (search, social, influencer, programmatic, emerging formats) to drive high-quality user growth.Plan, implement, and optimize media buys with a focus on efficiency.Manage and optimize performance of digital marketing channels.Oversee ad unit development, testing, and analysis for continuous improvement.Forecast, measure, and analyze digital campaign performance across the funnel.Test and scale new channels (ABM platforms, sponsored content, industry-specific ad networks) to expand reach.Refine our attribution models, marketing tech stack, and processes to ensure we’re always optimizing for maximum impact.Collaborate with sales and product teams to improve conversion rates. Build AI-first creative systems to rapidly prototype and test high-performing assets.Who You AreYou have 5+ years of experience in growth marketing and performance marketing, ideally in B2B SaaS for high-growth tech.You have a proven ability to launch, scale, and optimize paid channels.You have expertise in Paid Search, Paid Social, Display, Retargeting, Affiliate, CRO, and SEO.You are familiar with acquisition analysis, A/B testing, and ad fraud detection.You have an analytical mindset with strong attention to detail.You have up-to-date knowledge of B2B performance marketing standards and trends.You are a strong communicator and enjoy working cross-functionally with technical teams and stakeholders.You have a bachelor’s degree in marketing, business, or a related field.Where You'll BeThis role is based in London (UK) or Stockholm (Sweden).We offer you the flexibility to work where you work best! There will be some in person meetings, but still allows for flexibility to work from home.Spotify is an equal opportunity employer. You are welcome at Spotify for who you are, no matter where you come from, what you look like, or what’s playing in your headphones. Our platform is for everyone, and so is our workplace. The more voices we have represented and amplified in our business, the more we will all thrive, contribute, and be forward-thinking! So bring us your personal experience, your perspectives, and your background. It’s in our differences that we will find the power to keep revolutionizing the way the world listens.At Spotify, we are passionate about inclusivity and making sure our entire recruitment process is accessible to everyone. We have ways to request reasonable accommodations during the interview process and help assist in what you need. If you need accommodations at any stage of the application or interview process, please let us know - we’re here to support you in any way we can.Spotify transformed music listening forever when we launched in 2008. Our mission is to unlock the potential of human creativity by giving a million creative artists the opportunity to live off their art and billions of fans the chance to enjoy and be passionate about these creators. Everything we do is driven by our love for music and podcasting. Today, we are the world’s most popular audio streaming subscription service.","Full-time","4296605420","Musicians","https://www.linkedin.com/jobs/search/?currentJobId=4289763903&geoId=105117694&keywords=fraud%20detection&origin=JOB_SEARCH_PAGE_SEARCH_BUTTON&refresh=true","Marketing",,,,,"https://se.linkedin.com/jobs/view/senior-growth-marketing-manager-backstage-at-spotify-4296605420?refId=wKFzMIXN2KX79fsVEFx7Kw%3D%3D&trackingId=SZNx9%2BPyO1K12EfJU5kIOw%3D%3D&position=17&pageNum=0","Stockholm, Stockholm County, Sweden","2025-09-06","wKFzMIXN2KX79fsVEFx7Kw==","","",,"Mid-Senior level","Senior Growth Marketing Manager - Backstage","SZNx9+PyO1K12EfJU5kIOw=="
