"applicantsCount","applyUrl","benefits/0","companyAddress/addressCountry","companyAddress/addressLocality","companyAddress/addressRegion","companyAddress/postalCode","companyAddress/streetAddress","companyAddress/type","companyDescription","companyEmployeesCount","companyLinkedinUrl","companyLogo","companyName","companySlogan","companyWebsite","descriptionHtml","descriptionText","employmentType","id","industries","inputUrl","jobFunction","jobPosterName","jobPosterPhoto","jobPosterProfileUrl","jobPosterTitle","link","location","postedAt","refId","salary","salaryInfo/0","salaryInfo/1","seniorityLevel","title","trackingId"
"61","","Actively Hiring","SE","Norrmalm","Stockholm County","111 21","Mäster Samuelsgatan 56","PostalAddress","Truecaller is the leading global platform for verifying contacts and blocking unwanted communication for over 433 million people every month. We enable safe and relevant conversations between people and make it efficient for businesses to connect with consumers. Our mission, the reason for our being, is to build trust in communication.

Headquartered in Stockholm since 2009, we are an entrepreneurial company with a highly experienced management team.","594","https://se.linkedin.com/company/truecaller?trk=public_jobs_jserp-result_job-search-card-subtitle","https://media.licdn.com/dms/image/v2/D4D0BAQHQFzWYKB701A/company-logo_100_100/company-logo_100_100/0/1736429436204/truecaller_logo?e=1760572800&v=beta&t=ghHX3uOYx-I8B3w6OqXNsnrkQgdWvfCFlaAKNsgUAVs","Truecaller","Making tomorrow's communication smarter, safer, and more efficient for over 450 million people every month.","http://www.truecaller.com","<p><strong>Hej, Truecaller is calling you from Stockholm, Sweden! Ready to pick up?</strong></p><p><br></p><p>Our goal is to make communication smarter, safer, and more efficient, while building trust across the world. With our roots in Sweden and a global reach, we deliver smart services that create meaningful social impact. We are committed to protecting you from fraud, harassment, scam calls, and unwanted messages, so you can focus on the conversations that matter.</p><p><br></p><ul><li>Top <strong>20</strong> most downloaded apps globally, and the world’s <strong>#1</strong> caller ID and spam-blocking service for Android and iOS, with extensive AI capabilities, with more than <strong>450</strong> <strong>million active users</strong> per month.</li><li>Founded in 2009, listed on Nasdaq OMX Stockholm and is categorized as a Large Cap. Our focus on innovation, operational excellence, sustainable growth, and collaboration has resulted in consistently high profitability and strong EBITDA margins.</li><li>A team of 400 people from ~35 different nationalities spread across our headquarters in Stockholm and offices in Bangalore, Mumbai, Gurgaon, and Tel Aviv, with high ambitions.</li></ul><p><br></p><p><strong>As a Staff Data Scientist for the Search team</strong>, you’ll lead high-impact initiatives that directly shape user experiences across core features like Caller ID, Spam &amp; Fraud Protection, and Name Resolution. Your work will drive innovation in spam detection, name accuracy, and large-scale experimentation. Ideal for someone who excels at the crossroads of data science, product, and engineering, leveraging ML, stats, and data engineering to solve meaningful, real-world problems.</p><p><br></p><p><strong>The impact you will create: </strong><em> </em></p><ul><li>Exploring the problem space and finding data science solutions that provide step increases in customer experience.</li><li>Planning data science work for the team, with an emphasis on collaboration to achieve common goals.</li><li>Lead efforts to detect and prevent spam, ensuring user safety and platform trust.</li><li>Drive the development and optimization of name election algorithms to improve identity accuracy.</li><li>Design and run large-scale experiments to improve user experience and feature performance.</li><li>Collaborate cross-functionally with product, engineering, and analytics teams to implement data-driven solutions.</li><li>Translate complex data insights into clear strategies and actions.</li></ul><p><br></p><p><strong>What you bring in: </strong></p><ul><li><strong>Bachelor's or Master's degree in Data Science</strong>, Machine Learning, Computer Science, Statistics, Mathematics, Physics, or a related field.</li><li><strong>At least 7 years of experience</strong> in using data science and machine learning to solve real-world problems</li><li>A track record <strong>leading data science projects</strong> in a team, collaborating in planning, coding, and communication</li><li>Excellent programming skills in <strong>Python, SQL</strong></li><li>Solid understanding and experience with the <strong>tooling for Python</strong> - IDEs, unit testing frameworks, and static code checks</li><li><strong>Excellent communication</strong> and interpersonal skills, with the ability to present complex data and insights to non-technical stakeholders</li><li><strong>Strong problem-solving skills</strong> and a results-oriented mindset</li><li>Customer obsession</li><li>Able to own and drive projects and products to production and iteratively improve them over time</li></ul><p><br></p><p><strong>It would be great if you also have:</strong></p><ul><li>Understanding how to query very large data efficiently (we use BigQuery)</li><li>Experience collaborating with C-suite executives</li><li>Experience with data from mobile applications</li><li>Experience with data visualization and reporting tools, such as Tableau, Looker, or Power BI (we use Looker)</li><li>Solid understanding of engineering requirements necessary to put machine learning solutions into production and scale them to hundreds of millions of customers</li></ul><p><br></p><p><strong>Life at Truecaller - </strong>Behind the code:<strong> https://www.instagram.com/lifeattruecaller/</strong></p><p><br></p><p><strong>Sounds like your dream job?</strong></p><p>We will fill the position as soon as we find the right candidate, so please send your application as soon as possible. As part of the recruitment process, we will conduct a background check.</p><p><br></p><p><strong>This position is based in Stockholm, Sweden. </strong></p><p><br></p><p>We only accept applications <strong>in English</strong>.</p><p><br></p><p><strong>What we offer: </strong></p><ul><li><strong>A smart, talented, and agile team: </strong>An international team where ~35 nationalities are working together in several locations and time zones with a learning, sharing, and fun environment.</li><li><strong>A great compensation package</strong>: Competitive salary, 30 days of paid vacation, flexible working hours, private health insurance, parental leave top-up, pension contribution, Udemy membership to keep learning and improving, and free gym membership.</li><li><strong>Great tech tools:</strong> Pick the computer and phone you fancy most within our budget ranges.</li><li><strong>Office life: </strong>We strongly believe in in-person collaboration and follow an office-first approach while offering some flexibility. Enjoy your days with great colleagues with loads of good stuff to learn from, and a wide range of yummy snacks and beverages. In addition, now and then, check out the playroom for a fun break or join our exciting parties and or team activities such as Lab days, Running team, movie nights in our cinema, or a Geek lunch. There’s something for everyone!</li></ul><p><br></p><p><strong>Come as you are:</strong></p><p>Truecaller is diverse, equal, and inclusive. We need a variety of backgrounds, perspectives, beliefs, and experiences to keep building our great products. No matter where you are based, which language you speak, your accent, race, religion, color, nationality, gender, sexual orientation, age, marital status, etc. All those things make you who you are, and that’s why we would love to meet you.</p>","Hej, Truecaller is calling you from Stockholm, Sweden! Ready to pick up?Our goal is to make communication smarter, safer, and more efficient, while building trust across the world. With our roots in Sweden and a global reach, we deliver smart services that create meaningful social impact. We are committed to protecting you from fraud, harassment, scam calls, and unwanted messages, so you can focus on the conversations that matter.Top 20 most downloaded apps globally, and the world’s #1 caller ID and spam-blocking service for Android and iOS, with extensive AI capabilities, with more than 450 million active users per month.Founded in 2009, listed on Nasdaq OMX Stockholm and is categorized as a Large Cap. Our focus on innovation, operational excellence, sustainable growth, and collaboration has resulted in consistently high profitability and strong EBITDA margins.A team of 400 people from ~35 different nationalities spread across our headquarters in Stockholm and offices in Bangalore, Mumbai, Gurgaon, and Tel Aviv, with high ambitions.As a Staff Data Scientist for the Search team, you’ll lead high-impact initiatives that directly shape user experiences across core features like Caller ID, Spam &amp; Fraud Protection, and Name Resolution. Your work will drive innovation in spam detection, name accuracy, and large-scale experimentation. Ideal for someone who excels at the crossroads of data science, product, and engineering, leveraging ML, stats, and data engineering to solve meaningful, real-world problems.The impact you will create:  Exploring the problem space and finding data science solutions that provide step increases in customer experience.Planning data science work for the team, with an emphasis on collaboration to achieve common goals.Lead efforts to detect and prevent spam, ensuring user safety and platform trust.Drive the development and optimization of name election algorithms to improve identity accuracy.Design and run large-scale experiments to improve user experience and feature performance.Collaborate cross-functionally with product, engineering, and analytics teams to implement data-driven solutions.Translate complex data insights into clear strategies and actions.What you bring in: Bachelor's or Master's degree in Data Science, Machine Learning, Computer Science, Statistics, Mathematics, Physics, or a related field.At least 7 years of experience in using data science and machine learning to solve real-world problemsA track record leading data science projects in a team, collaborating in planning, coding, and communicationExcellent programming skills in Python, SQLSolid understanding and experience with the tooling for Python - IDEs, unit testing frameworks, and static code checksExcellent communication and interpersonal skills, with the ability to present complex data and insights to non-technical stakeholdersStrong problem-solving skills and a results-oriented mindsetCustomer obsessionAble to own and drive projects and products to production and iteratively improve them over timeIt would be great if you also have:Understanding how to query very large data efficiently (we use BigQuery)Experience collaborating with C-suite executivesExperience with data from mobile applicationsExperience with data visualization and reporting tools, such as Tableau, Looker, or Power BI (we use Looker)Solid understanding of engineering requirements necessary to put machine learning solutions into production and scale them to hundreds of millions of customersLife at Truecaller - Behind the code: https://www.instagram.com/lifeattruecaller/Sounds like your dream job?We will fill the position as soon as we find the right candidate, so please send your application as soon as possible. As part of the recruitment process, we will conduct a background check.This position is based in Stockholm, Sweden. We only accept applications in English.What we offer: A smart, talented, and agile team: An international team where ~35 nationalities are working together in several locations and time zones with a learning, sharing, and fun environment.A great compensation package: Competitive salary, 30 days of paid vacation, flexible working hours, private health insurance, parental leave top-up, pension contribution, Udemy membership to keep learning and improving, and free gym membership.Great tech tools: Pick the computer and phone you fancy most within our budget ranges.Office life: We strongly believe in in-person collaboration and follow an office-first approach while offering some flexibility. Enjoy your days with great colleagues with loads of good stuff to learn from, and a wide range of yummy snacks and beverages. In addition, now and then, check out the playroom for a fun break or join our exciting parties and or team activities such as Lab days, Running team, movie nights in our cinema, or a Geek lunch. There’s something for everyone!Come as you are:Truecaller is diverse, equal, and inclusive. We need a variety of backgrounds, perspectives, beliefs, and experiences to keep building our great products. No matter where you are based, which language you speak, your accent, race, religion, color, nationality, gender, sexual orientation, age, marital status, etc. All those things make you who you are, and that’s why we would love to meet you.","Full-time","4294583511","Software Development","https://www.linkedin.com/jobs/search/?currentJobId=4289763903&geoId=105117694&keywords=fraud%20detection&origin=JOB_SEARCH_PAGE_SEARCH_BUTTON&refresh=true","Information Technology and Engineering",,,,,"https://se.linkedin.com/jobs/view/staff-data-scientist-at-truecaller-4294583511?refId=wKFzMIXN2KX79fsVEFx7Kw%3D%3D&trackingId=2zESDiNqmIcsTwm98LADvQ%3D%3D&position=3&pageNum=0","Stockholm, Stockholm County, Sweden","2025-09-03","wKFzMIXN2KX79fsVEFx7Kw==","","",,"Mid-Senior level","Staff Data Scientist","2zESDiNqmIcsTwm98LADvQ=="
"200","https://join.froda.se/jobs/6103610-data-scientist",,"SE","Stockholm","Stockholm County","116 45","Katarinavägen 9","PostalAddress","Froda is a tech company committed to empowering entrepreneurs by simplifying access to financing for all small businesses. We use digitization and machine learning to break down traditional financial barriers, ensuring unbiased support for founders. Our data-driven approach promotes innovation, diversity, and inclusivity, significantly impacting the communities we serve.","118","https://se.linkedin.com/company/froda?trk=public_jobs_jserp-result_job-search-card-subtitle","https://media.licdn.com/dms/image/v2/D560BAQG1gF_apnD-Zg/company-logo_100_100/company-logo_100_100/0/1719255890329/froda_logo?e=1760572800&v=beta&t=VOoOBjIguLUrJQmGtjwLc_lf2yY1_kkSbvowCIX4U-0","Froda","Dedicated to empowering entrepreneurs by simplifying access to financing for all SMEs globally. ","froda.se","We’re looking for a driven and skilled <strong>Data Scientist </strong>to design, deploy, and optimize ML models that drive automation and impact key areas like credit risk and fraud detection. Join us to shape the future of ML at Froda!<br><br><strong>About Froda<br><br></strong>Froda was founded in 2015 with a clear mission – to democratize the access to financing and provide small businesses the same opportunities to grow as large ones. Through digital processes and technological innovation, we have shortened the loan process from months to minutes, making it easy and affordable for business owners to invest in their ideas. Our objective approach champions diversity, ensures fair terms, and ultimately enables more small businesses to make a positive impact on society.<br><br>Join our team and contribute to giving small businesses the opportunity to invest in their ideas to the best possible terms.<br><br>Your Impact<br><br>Design, build, and deploy machine learning models to drive automation and efficiency across areas like credit risk, fraud detection, AML, customer service, and business analytics. Collaborate with cross-functional teams to build scalable, robust solutions that support Froda’s strategic goals of scalability, standardization, and reliability.<br><br>What You'll Do<br><br><ul><li>Collaborate with product, engineering, and analytics teams to deliver scalable and impactful AI and ML solutions.</li><li>Design, build, and deploy ML models and pipelines for critical business areas.</li><li>Implement and optimize ML-Ops workflows (data processing, model training, deployment, and monitoring).<br><br></li></ul>What You'll Bring<br><br><ul><li>Experience of working as a Data Scientist or ML Engineer in tech, fintech, or a similar product-driven company.</li><li>Hands-on experience with production ML pipelines, ML-Ops frameworks, and cloud platforms (e.g., KubeFlow, Azure).</li><li>Proven skills in Python, SQL, and ML libraries (TensorFlow, PyTorch, Scikit-learn, etc.).</li><li>Experience with LLMs (e.g., GPT APIs, fine-tuning, prompt engineering, RAG).</li><li>Knowledge of credit risk, fraud detection, or AML is a clear plus.<br><br></li></ul>Who You Are<br><br><ul><li>Results-driven problem solver with a passion for impact through data and AI and that thrives in a fast-paced, dynamic environment.</li><li>Collaborative team player, contributing to innovation and knowledge-sharing in the team and across the business.</li><li>Strong communicator, able to break down complex ideas into clear insights.<br><br></li></ul>What’s in it for you?<br><br>Working at Froda means working at a company that combines the best of both worlds – fun and fast-paced culture, yet stable and structured. We are 90+ ambitious self-starters who genuinely care for each other and the work we do, while having fun together. You will have the ability to impact your own work and that the only thing standing between you and your goals is going to be your own ambitions.<br><br>Furthermore, you’ll get:<br><br><ul><li>Fabulous office overlooking Stockholm and a friendly culture that values work/life balance</li><li>We prioritize working in the office to maximize the positive impact of in-person collaboration, but we offer flexibility with work hours and remote work</li><li>Competitive compensation package</li><li>Insurance and pension plan<br><br></li></ul>Be part of a growing team where your work directly impacts the company’s success. Join us in driving meaningful change through AI and machine learning.<br><br>Please note that due to summer vacations, our response time may be delayed.","We’re looking for a driven and skilled Data Scientist to design, deploy, and optimize ML models that drive automation and impact key areas like credit risk and fraud detection. Join us to shape the future of ML at Froda!About FrodaFroda was founded in 2015 with a clear mission – to democratize the access to financing and provide small businesses the same opportunities to grow as large ones. Through digital processes and technological innovation, we have shortened the loan process from months to minutes, making it easy and affordable for business owners to invest in their ideas. Our objective approach champions diversity, ensures fair terms, and ultimately enables more small businesses to make a positive impact on society.Join our team and contribute to giving small businesses the opportunity to invest in their ideas to the best possible terms.Your ImpactDesign, build, and deploy machine learning models to drive automation and efficiency across areas like credit risk, fraud detection, AML, customer service, and business analytics. Collaborate with cross-functional teams to build scalable, robust solutions that support Froda’s strategic goals of scalability, standardization, and reliability.What You'll DoCollaborate with product, engineering, and analytics teams to deliver scalable and impactful AI and ML solutions.Design, build, and deploy ML models and pipelines for critical business areas.Implement and optimize ML-Ops workflows (data processing, model training, deployment, and monitoring).What You'll BringExperience of working as a Data Scientist or ML Engineer in tech, fintech, or a similar product-driven company.Hands-on experience with production ML pipelines, ML-Ops frameworks, and cloud platforms (e.g., KubeFlow, Azure).Proven skills in Python, SQL, and ML libraries (TensorFlow, PyTorch, Scikit-learn, etc.).Experience with LLMs (e.g., GPT APIs, fine-tuning, prompt engineering, RAG).Knowledge of credit risk, fraud detection, or AML is a clear plus.Who You AreResults-driven problem solver with a passion for impact through data and AI and that thrives in a fast-paced, dynamic environment.Collaborative team player, contributing to innovation and knowledge-sharing in the team and across the business.Strong communicator, able to break down complex ideas into clear insights.What’s in it for you?Working at Froda means working at a company that combines the best of both worlds – fun and fast-paced culture, yet stable and structured. We are 90+ ambitious self-starters who genuinely care for each other and the work we do, while having fun together. You will have the ability to impact your own work and that the only thing standing between you and your goals is going to be your own ambitions.Furthermore, you’ll get:Fabulous office overlooking Stockholm and a friendly culture that values work/life balanceWe prioritize working in the office to maximize the positive impact of in-person collaboration, but we offer flexibility with work hours and remote workCompetitive compensation packageInsurance and pension planBe part of a growing team where your work directly impacts the company’s success. Join us in driving meaningful change through AI and machine learning.Please note that due to summer vacations, our response time may be delayed.","Full-time","4273012507","Financial Services","https://www.linkedin.com/jobs/search/?currentJobId=4289763903&geoId=105117694&keywords=fraud%20detection&origin=JOB_SEARCH_PAGE_SEARCH_BUTTON&refresh=true","Engineering and Information Technology",,,,,"https://se.linkedin.com/jobs/view/data-scientist-at-froda-4273012507?refId=wKFzMIXN2KX79fsVEFx7Kw%3D%3D&trackingId=663IHp51Udg281dpbiTU%2BQ%3D%3D&position=2&pageNum=0","Stockholm, Stockholm County, Sweden","2025-07-27","wKFzMIXN2KX79fsVEFx7Kw==","","",,"Entry level","Data Scientist","663IHp51Udg281dpbiTU+Q=="
