"applicantsCount","applyUrl","benefits/0","companyAddress/addressCountry","companyAddress/addressLocality","companyAddress/addressRegion","companyAddress/postalCode","companyAddress/streetAddress","companyAddress/type","companyDescription","companyEmployeesCount","companyLinkedinUrl","companyLogo","companyName","companySlogan","companyWebsite","descriptionHtml","descriptionText","employmentType","id","industries","inputUrl","jobFunction","jobPosterName","jobPosterPhoto","jobPosterProfileUrl","jobPosterTitle","link","location","postedAt","refId","salary","salaryInfo/0","salaryInfo/1","seniorityLevel","title","trackingId"
"25","https://join.com/companies/prestatech/14757019-senior-data-scientist-m-f-d?pid=e65242534431eadcb0c9","Be an early applicant","DE","Berlin","BE","10178","Rosenthaler Straße 46","PostalAddress","Prestatech is a leading fintech platform that empowers financial institutions to make faster, smarter, and more reliable credit decisions for both consumers and SMEs.

We combine intelligent document automation, advanced anti-fraud algorithms, and the granularity of bank account and financial data to streamline the entire credit analysis and decision-making process. By integrating cutting-edge technology with deep financial expertise, we help our clients reduce risk, increase efficiency, and enhance customer experiences.

Our solutions are trusted by banks, lending platforms, asset managers, and brokers across Europe and the USA. With Prestatech, financial institutions can move beyond traditional processes and embrace a data-driven future in credit risk management.

Automating credit decisions with intelligence, data, and trust.","35","https://de.linkedin.com/company/prestatech-gmbh?trk=public_jobs_jserp-result_job-search-card-subtitle","https://media.licdn.com/dms/image/v2/D4D0BAQHaM3xuKHuIMA/company-logo_100_100/B4DZWpCULMGcAQ-/0/1742297711777/prestatech_gmbh_logo?e=1760572800&v=beta&t=enyXMuPFAsRJQLiUKesiZ8s3wv7UuelWq6d6n8z3vg0","Prestatech","Prestatech is a credit intelligence platform that enables faster and more accurate financial decisions.","http://prestatech.com","<p><strong>About Prestatech</strong></p><br><p>At Prestatech, we're redefining the financial world by fostering innovation and challenging the traditional banking system. Our culture is diverse, dynamic, and forward-thinking. From our offices in Berlin and Milan, we create cutting-edge API technologies in an inclusive environment where everyone can contribute their best work.</p><br><p>Founded in 2021 by Christian Nothacker, Luca Terragni, and Lorenzo Giusti, Prestatech combines document automation and proprietary technology to help financial institutions and B2B companies make quick, reliable, and inclusive credit decisions for SMEs and consumers.</p><br><p>When most people think of getting a loan or mortgage, they picture a slow and tedious process. Our mission is to simplify that through technology.</p><br><p>We’re a young and fast-growing company—but this is our second venture. Before Prestatech, we founded and exited Prestacap, a lending platform for SMEs active in Italy and Germany.</p><br><p>We’re passionate about data and technology, never satisfied with the status quo, and believe that teamwork is key to achieving ambitious goals together.</p><br><p>To date, we have raised €8 million, which is helping us bring more innovative solutions to market, expand operations in Italy, and launch in the UK, Germany, and the US..</p><br><p>We’re now looking for a <strong>Senior Data Scientist (m/f/d)</strong>, someone with prior experience in fintech who is hands-on, outcome-driven, and deeply curious about solving business problems with data and AI.</p><br>Tasks<br><p>You would be joining a flexible and dynamic team and your role will include: </p><br><ul><br><li>selecting features, building and optimizing classifiers using machine learning techniques </li><br><li>processing, cleansing and verifying the integrity of data used for analysis </li><br><li>deep dive on the problems using SQL and scripting languages to drive solutions leveraging Statistical Analysis </li><br><li>implement and scale data pipelines and solutions using Big Data technologies </li><br><li>design, train, and deploy machine learning models and AI-based solutions for credit scoring, fraud detection, and other core financial applications. </li><br><li>collaborate closely with the development team to recommend and build innovations based on Data Science </li><br><li>own the process: identify and execute on high impact projects, triage external requests, and make sure you bring projects to conclusion in time for the results to be useful </li><br><li>leverage AI tools to achieve even better and faster results</li><br></ul><br>Requirements<br><ul><br><li>6+ years of experience in Data Science, ideally in fintech or financial services </li><br><li>Bachelor’s degree in Computer Science, Data Science, Mathematics or related field (MSc/PhD preferred) </li><br><li>Strong understanding of Big Data frameworks and cloud platforms.</li><br><li>Expertise in machine learning and AI techniques </li><br><li>Proficient in Python, with hands-on experience using Pandas, NumPy, Scikit-learn </li><br><li>Skilled in working with SQL/NoSQL databases </li><br><li>Experience with version control (Git) and writing clean, maintainable code </li><br><li>Experience with financial datasets, credit scoring, or risk modeling is a strong plus  </li><br></ul><br><p>Not sure you meet evert single requirement? Don’t worry — if this role excites you and you believe you could be a good fit, we’d still love to hear from you. At Prestatech, we value potential, curiosity, and passion just as much as experience.</p><br>Benefits<br><ul><br><li>Excellent compensation aligned with your experience and impact</li><br><li>A career path that allows you to take yourself to the next level</li><br><li>Annual training budget to help you grow and develop</li><br><li>2 days per week of Smart Working (+ 3 days at the office)</li><br><li>Flexible working arrangements, with the understanding that building a successful startup sometimes requires periods of focused, intense work</li><br><li>Bi-annual company offsites</li><br><li>Referral bonus</li><br><li>a co-working office in one of the best district of Milan (Isola)</li><br></ul><br><p><strong>Recruitment Process:</strong></p><br><ul><br><li>HR Interview (30 minutes)</li><br><li>Assessment Test (up to 60 minutes)</li><br><li>CEO/CTO Interview (30 minutes)</li><br></ul><br><p>If you have any specific requirements or need accommodations during the recruitment process, please let us know — we’re happy to support you.</p><br><p>At Prestatech, we actively embrace diversity and are committed to fostering a safe, inclusive, and welcoming workplace for everyone. Our recruitment process is free from discrimination of any kind — including on the basis of race, national or ethnic origin, age, religion, disability, sex, gender identity, or sexual orientation.</p><br><p>With over 25 employees from more than 15 different countries, our diversity drives innovation, enriches our culture, and challenges us to consider multiple perspectives every day.</p>","About PrestatechAt Prestatech, we're redefining the financial world by fostering innovation and challenging the traditional banking system. Our culture is diverse, dynamic, and forward-thinking. From our offices in Berlin and Milan, we create cutting-edge API technologies in an inclusive environment where everyone can contribute their best work.Founded in 2021 by Christian Nothacker, Luca Terragni, and Lorenzo Giusti, Prestatech combines document automation and proprietary technology to help financial institutions and B2B companies make quick, reliable, and inclusive credit decisions for SMEs and consumers.When most people think of getting a loan or mortgage, they picture a slow and tedious process. Our mission is to simplify that through technology.We’re a young and fast-growing company—but this is our second venture. Before Prestatech, we founded and exited Prestacap, a lending platform for SMEs active in Italy and Germany.We’re passionate about data and technology, never satisfied with the status quo, and believe that teamwork is key to achieving ambitious goals together.To date, we have raised €8 million, which is helping us bring more innovative solutions to market, expand operations in Italy, and launch in the UK, Germany, and the US..We’re now looking for a Senior Data Scientist (m/f/d), someone with prior experience in fintech who is hands-on, outcome-driven, and deeply curious about solving business problems with data and AI.TasksYou would be joining a flexible and dynamic team and your role will include: selecting features, building and optimizing classifiers using machine learning techniques processing, cleansing and verifying the integrity of data used for analysis deep dive on the problems using SQL and scripting languages to drive solutions leveraging Statistical Analysis implement and scale data pipelines and solutions using Big Data technologies design, train, and deploy machine learning models and AI-based solutions for credit scoring, fraud detection, and other core financial applications. collaborate closely with the development team to recommend and build innovations based on Data Science own the process: identify and execute on high impact projects, triage external requests, and make sure you bring projects to conclusion in time for the results to be useful leverage AI tools to achieve even better and faster resultsRequirements6+ years of experience in Data Science, ideally in fintech or financial services Bachelor’s degree in Computer Science, Data Science, Mathematics or related field (MSc/PhD preferred) Strong understanding of Big Data frameworks and cloud platforms.Expertise in machine learning and AI techniques Proficient in Python, with hands-on experience using Pandas, NumPy, Scikit-learn Skilled in working with SQL/NoSQL databases Experience with version control (Git) and writing clean, maintainable code Experience with financial datasets, credit scoring, or risk modeling is a strong plus  Not sure you meet evert single requirement? Don’t worry — if this role excites you and you believe you could be a good fit, we’d still love to hear from you. At Prestatech, we value potential, curiosity, and passion just as much as experience.BenefitsExcellent compensation aligned with your experience and impactA career path that allows you to take yourself to the next levelAnnual training budget to help you grow and develop2 days per week of Smart Working (+ 3 days at the office)Flexible working arrangements, with the understanding that building a successful startup sometimes requires periods of focused, intense workBi-annual company offsitesReferral bonusa co-working office in one of the best district of Milan (Isola)Recruitment Process:HR Interview (30 minutes)Assessment Test (up to 60 minutes)CEO/CTO Interview (30 minutes)If you have any specific requirements or need accommodations during the recruitment process, please let us know — we’re happy to support you.At Prestatech, we actively embrace diversity and are committed to fostering a safe, inclusive, and welcoming workplace for everyone. Our recruitment process is free from discrimination of any kind — including on the basis of race, national or ethnic origin, age, religion, disability, sex, gender identity, or sexual orientation.With over 25 employees from more than 15 different countries, our diversity drives innovation, enriches our culture, and challenges us to consider multiple perspectives every day.","Contract","4289851783","Software Development","https://www.linkedin.com/jobs/search/?currentJobId=4269230069&geoId=103350119&keywords=fraud%20detection&origin=JOB_SEARCH_PAGE_SEARCH_BUTTON&refresh=true","Information Technology",,,,,"https://it.linkedin.com/jobs/view/senior-data-scientist-m-f-d-at-prestatech-4289851783?refId=wtnRS97yTSrT8%2BiWougIAQ%3D%3D&trackingId=ZTi1FH%2Fk1PrrO9cvwxoprw%3D%3D&position=10&pageNum=0","Milan, Lombardy, Italy","2025-08-27","wtnRS97yTSrT8+iWougIAQ==","","",,"Associate","Senior Data Scientist (m/f/d)","ZTi1FH/k1PrrO9cvwxoprw=="
"102","https://fa-ewwx-saasfaprod1.fa.ocs.oraclecloud.com/hcmUI/CandidateExperience/en/job/2430/?utm_medium=jobboard&utm_source=linkedin","Actively Hiring","IT","Milano","Mi","20149","Corso Sempione 55","PostalAddress","Nexi, in Italy is the leading PayTech company, the reference point for the digital payments in the Country. The company, listed on MTA of Borsa Italiana, operates in strong partnership with ~150 partner banks: thanks to its end-to-end omni-channel technology connects banks, merchants and consumers with the aim of changing the way people and companies pay and collect money every day, thus accelerating the spread of digital payments and the transition to a cashless society, which is essential for the modernization of the Country. Nexi operates in three market areas: Merchant Services & Solutions, Cards & Digital Payments and Digital Banking Solutions. Merchant Services & Solutions: Nexi, together with its partner Banks, serves c. 900,000 merchants; Cards & Digital Payments: Nexi, together with its partner Banks, manages c. 43 million payment cards; Digital Banking Solutions: Nexi manages c. 12.800 ATMs, c. 480,000 e-banking workstations and c. 900 million clearing transactions. In addition, Nexi, as a technological partner, developed the CBI S.c.p.a. open banking system, to which the main Italian banks have already adhered.","1377","https://it.linkedin.com/company/nexipayments?trk=public_jobs_jserp-result_job-search-card-subtitle","https://media.licdn.com/dms/image/v2/D4D0BAQHsQFbFtdTepw/company-logo_100_100/B4DZfE.oqvGgAQ-/0/1751356443657/nexipayments_logo?e=1760572800&v=beta&t=zfdyV1hScstEjfVpSwWtFzChV7dkj4-WXrKp_8vaoeU","Nexi Italy","part of Nexi Group, The European PayTech.","https://www.nexi.it/","<strong>Job Description<br><br></strong><strong>Shape the Future of Payments with Nexi in 2025<br><br></strong>Envision a world where every transaction feels effortless, safe, and connected. At Nexi, we’re leading this transformation, building tools and solutions that redefine how the world pays. By joining us, you’ll play a part in creating the next generation of digital payments in an innovative, supportive, and international environment.<br><br><strong>Why This Role Is Right for You<br><br></strong>As a <strong>Senior Fraud Intelligence Specialist</strong>, you’ll join a collaborative and forward-thinking team based in Italy - Milan. The Senior Fraud Intelligence Specialist plays a critical role in the end-to-end fraud prevention strategy, working cross-functionally with the different departments of the Fraud Intelligence office.<br><br>The role combines investigative expertise, strategic thinking, and a data-driven approach to identify emerging fraud trends, propose innovative fraud rules and algorithms, and support the evolution of fraud systems and operational processes.<br><br><strong>About Your Future Role<br><br></strong>In this position, you will:<br><br><ul><li> Perform in-depth analysis of fraud cases to detect emerging trends, points of compromise, fraudulent merchants, and complex attack patterns. </li><li> Write, optimize, and maintain fraud detection rules in collaboration with operational and technical teams. </li><li> Support blacklisting and mitigation actions on IP addresses, merchants, devices, and fraudulent e-commerce accounts. </li><li> Collaborate with the Fraud Innovation &amp; Key Projects team to define business requirements and provide expert input on fraud-related initiatives and system evolution. </li><li> Contribute to the design and testing of advanced fraud detection algorithms in close cooperation with the Fraud Analytics Lab. </li><li> Support continuous improvement of fraud alert workflows and performance monitoring (KPIs), including automation proposals. </li><li> Act as a liaison between Fraud Intelligence teams, Contact Centers, and banking partners for the handling of critical fraud cases and SLA governance. </li><li> Coach and mentor junior analysts within the operational or analytics teams. <br><br></li></ul><strong>What Makes You a Great Fit<br><br></strong>We’re looking for someone eager to make a difference. Here’s what we value:<br><br><strong>Essential Qualifications<br><br></strong><ul><li> Proven experience in fraud prevention or investigation (minimum 2–4 years), preferably in digital payments or banking environments. </li><li> Strong data analysis skills, including proficiency in SQL and Excel. Knowledge of SAS, Python, and PowerBI is a strong plus. </li><li> Deep understanding of fraud schemes targeting e-commerce and card payments. </li><li> Hands-on experience with the design, tuning, and monitoring of fraud detection rules. </li><li> Familiarity with fraud prevention systems (e.g., rules engines, blacklisting tools, alert workflows). </li><li> Excellent investigative and analytical thinking. </li><li> Proactive mindset with a strong sense of ownership and continuous improvement. </li><li> Clear communication skills for both technical and non-technical stakeholders. </li><li> Ability to work effectively in cross-functional teams and manage shifting priorities. </li><li> Operational flexibility and resilience in high-pressure situations. <br><br></li></ul><strong>Bonus Skills<br><br></strong><ul><li> Experience working with cloud-based fraud platforms (e.g., AWS). </li><li> Previous mentoring or team coordination experience. </li><li> Knowledge of relevant regulations and frameworks (e.g., PSD2, AML). <br><br></li></ul>Even if you don’t check every box, <strong>your unique potential and willingness to learn</strong> could set you apart.<br><br><strong>What’s in it for You</strong>?<br><br><ul><li>Attractive salary and a competitive benefits package to reward your expertise and contributions </li><li>Tech equipment: Get the tools you need to succeed, including the latest technology to support your work</li><li>Join an international team: Collaborate with experts from across Europe and bring your ideas to life in a dynamic, global environment </li><li>Grow and develop: Gain hands-on experience and structured training through our PayTech University, designed to accelerate your career and help you reach your full potential<br><br></li></ul><strong>Discover Life at Nexi<br><br></strong>We’re an international team of 10,000+ people across 25 countries, united by shared ambition and a passion for innovation. Learn more about our culture, Values, and how we’re shaping the future of digital payments. Visit our Life at Nexi page.<br><br><strong>Diversity and Inclusion at Nexi<br><br></strong>We are proud to be an equal opportunity employer: together, we succeed by embracing our differences and creating a future where everyone can thrive.<br><br><strong>Your Next Step Starts Here<br><br></strong>If this opportunity excites you, we’d love to hear your story. Submit your application today, and let’s shape the future of digital payments together!<br><br><strong>Responsibilities<br><br></strong><strong> QUALIFICATIONS</strong>","Job DescriptionShape the Future of Payments with Nexi in 2025Envision a world where every transaction feels effortless, safe, and connected. At Nexi, we’re leading this transformation, building tools and solutions that redefine how the world pays. By joining us, you’ll play a part in creating the next generation of digital payments in an innovative, supportive, and international environment.Why This Role Is Right for YouAs a Senior Fraud Intelligence Specialist, you’ll join a collaborative and forward-thinking team based in Italy - Milan. The Senior Fraud Intelligence Specialist plays a critical role in the end-to-end fraud prevention strategy, working cross-functionally with the different departments of the Fraud Intelligence office.The role combines investigative expertise, strategic thinking, and a data-driven approach to identify emerging fraud trends, propose innovative fraud rules and algorithms, and support the evolution of fraud systems and operational processes.About Your Future RoleIn this position, you will: Perform in-depth analysis of fraud cases to detect emerging trends, points of compromise, fraudulent merchants, and complex attack patterns.  Write, optimize, and maintain fraud detection rules in collaboration with operational and technical teams.  Support blacklisting and mitigation actions on IP addresses, merchants, devices, and fraudulent e-commerce accounts.  Collaborate with the Fraud Innovation &amp; Key Projects team to define business requirements and provide expert input on fraud-related initiatives and system evolution.  Contribute to the design and testing of advanced fraud detection algorithms in close cooperation with the Fraud Analytics Lab.  Support continuous improvement of fraud alert workflows and performance monitoring (KPIs), including automation proposals.  Act as a liaison between Fraud Intelligence teams, Contact Centers, and banking partners for the handling of critical fraud cases and SLA governance.  Coach and mentor junior analysts within the operational or analytics teams. What Makes You a Great FitWe’re looking for someone eager to make a difference. Here’s what we value:Essential Qualifications Proven experience in fraud prevention or investigation (minimum 2–4 years), preferably in digital payments or banking environments.  Strong data analysis skills, including proficiency in SQL and Excel. Knowledge of SAS, Python, and PowerBI is a strong plus.  Deep understanding of fraud schemes targeting e-commerce and card payments.  Hands-on experience with the design, tuning, and monitoring of fraud detection rules.  Familiarity with fraud prevention systems (e.g., rules engines, blacklisting tools, alert workflows).  Excellent investigative and analytical thinking.  Proactive mindset with a strong sense of ownership and continuous improvement.  Clear communication skills for both technical and non-technical stakeholders.  Ability to work effectively in cross-functional teams and manage shifting priorities.  Operational flexibility and resilience in high-pressure situations. Bonus Skills Experience working with cloud-based fraud platforms (e.g., AWS).  Previous mentoring or team coordination experience.  Knowledge of relevant regulations and frameworks (e.g., PSD2, AML). Even if you don’t check every box, your unique potential and willingness to learn could set you apart.What’s in it for You?Attractive salary and a competitive benefits package to reward your expertise and contributions Tech equipment: Get the tools you need to succeed, including the latest technology to support your workJoin an international team: Collaborate with experts from across Europe and bring your ideas to life in a dynamic, global environment Grow and develop: Gain hands-on experience and structured training through our PayTech University, designed to accelerate your career and help you reach your full potentialDiscover Life at NexiWe’re an international team of 10,000+ people across 25 countries, united by shared ambition and a passion for innovation. Learn more about our culture, Values, and how we’re shaping the future of digital payments. Visit our Life at Nexi page.Diversity and Inclusion at NexiWe are proud to be an equal opportunity employer: together, we succeed by embracing our differences and creating a future where everyone can thrive.Your Next Step Starts HereIf this opportunity excites you, we’d love to hear your story. Submit your application today, and let’s shape the future of digital payments together!Responsibilities QUALIFICATIONS","Full-time","4266678821","Financial Services","https://www.linkedin.com/jobs/search/?currentJobId=4269230069&geoId=103350119&keywords=fraud%20detection&origin=JOB_SEARCH_PAGE_SEARCH_BUTTON&refresh=true","Finance and Sales",,,,,"https://it.linkedin.com/jobs/view/senior-fraud-intelligence-specialist-at-nexi-italy-4266678821?refId=wtnRS97yTSrT8%2BiWougIAQ%3D%3D&trackingId=A58VnoUMvc%2F9O0hVnqbwMQ%3D%3D&position=7&pageNum=0","Milan, Lombardy, Italy","2025-07-24","wtnRS97yTSrT8+iWougIAQ==","","",,"Mid-Senior level","Senior Fraud Intelligence Specialist","A58VnoUMvc/9O0hVnqbwMQ=="
