"applicantsCount","applyUrl","benefits/0","companyAddress/addressCountry","companyAddress/addressLocality","companyAddress/addressRegion","companyAddress/postalCode","companyAddress/streetAddress","companyAddress/type","companyDescription","companyEmployeesCount","companyLinkedinUrl","companyLogo","companyName","companySlogan","companyWebsite","descriptionHtml","descriptionText","employmentType","id","industries","inputUrl","jobFunction","jobPosterName","jobPosterPhoto","jobPosterProfileUrl","jobPosterTitle","link","location","postedAt","refId","salary","salaryInfo/0","salaryInfo/1","seniorityLevel","title","trackingId"
"125","https://jobs.lever.co/yuno/12b94079-5efe-4102-96e7-60d8850d0517/apply?lever-source=LinkedIn&source=LinkedIn",,"US","New  York ",,,,"PostalAddress","Yuno is a leading global payment orchestration platform. We empower businesses to simplify their payment operations, maximize revenue, and accelerate global expansion. 

Yuno connects your business to over 1,000 global payment methods through a single API integration. Our Smart Routing tools use advanced algorithms to optimize the flow of transactions through various payment providers, maximizing acceptance rates while also reducing processing costs. Our wide selection of fraud prevention providers and advanced tokenization capabilities help reduce the risk of fraud and minimize transaction declines.

Yuno is the payment orchestration solution of choice for high-performing payments teams. We support some of the world’s leading brands, including McDonald’s, Rappi, Viva Aerobus, InDrive and other businesses across more than 80 countries.

Yuno was founded in 2022 and is led by former payments and technology executives from Rappi, Uber, Ali Pay and other leading companies. Yuno is backed by a consortium of high-profile investors, including DST Global Partners, Andreessen Horowitz, Tiger Global, Kaszek Ventures, and Monashees.","991","https://www.linkedin.com/company/yunopay?trk=public_jobs_jserp-result_job-search-card-subtitle","https://media.licdn.com/dms/image/v2/D560BAQGe-nlKrCnIpg/company-logo_100_100/B56Zcy8UdyHoAU-/0/1748906363071/yunopay_logo?e=1760572800&v=beta&t=Hpg1C7eZIZqMqx7pB45OyUQBBNr_n7hPkP50kFXhhss","Yuno","Yuno is a financial infrastructure platform that simplifies global payments for enterprise merchants around the world.","https://y.uno/","Remote, Europe, Full Time, Senior-Individual Contributor<br><br>🟣 Who We Are<br><br>Yuno enables any company to accept all available payment methods and manage fraud detection and prevention through a single integration. Our strength is in our people, founded by a team of experts in the payments and IT industries.<br><br>Yuno has built a high-performance payment orchestrator. Our technology gives companies access to top payment capabilities, allowing them to engage customers confidently and manage global business operations seamlessly.<br><br>Interested in joining a fast-growing fintech company? Keep on reading and discover how your future will be with Yuno.<br><br>🟣 Shape the Future of Payments in Europe (and Beyond)!<br><br>We are orchestrating the best high-performing team. If you are passionate about building impactful relationships and unlocking growth through strategic alliances, this role is your opportunity to help scale a global company at the forefront of payments innovation.<br><br>As a Strategic Partnerships Manager Europe, you will be at the forefront of Yuno’s growth in one of our most strategic regions. This is not just a role, it’s an opportunity to design, lead, and scale the partnerships function across a region with diverse payment ecosystems, high-growth potential, and enormous innovation opportunities.<br><br>You will define and execute Yuno’s European partnership strategy, building high-impact alliances that directly drive revenue and accelerate adoption. You’ll be the primary relationship owner for strategic partners, ensuring alignment, performance, and long-term value. Your work will directly influence how businesses and consumers interact with payments across Europe and globally.<br><br>🟣 Your Impact<br><br><ul><li> Strategic Market Building: Develop and execute Yuno’s European partnerships strategy, prioritizing markets and partner categories with the highest potential</li><li> High-Value Partner Portfolio: Source, negotiate, and manage strategic alliances with payment providers, fintechs, banks, PSPs, platforms, consultancies, and technology partners</li><li> Growth Acceleration: Structure partnerships that drive adoption, revenue growth, and expand Yuno’s footprint in existing and new markets</li><li> Revenue-Driven Partnerships: Build partnerships that directly drive revenue through co-selling, integrations, and referrals</li><li> Primary Relationship Owner: Act as the lead contact for strategic partners, ensuring alignment, performance, and long-term value on both sides</li><li> Partner Enablement: Collaborate with Sales, Marketing, and Product to create partner enablement materials, GTM plays, and co-marketing efforts</li><li> Cross-Functional Leadership: Work closely with Sales, Marketing, Product, and Operations to ensure partnerships deliver measurable results</li><li> Market Influence: Represent Yuno at industry events to strengthen our thought leadership in European and global payments</li><li> Scalability &amp; Metrics: Define success metrics and operational workflows to make partnerships scalable, repeatable, and impactful<br><br><br></li></ul>🟣 How Yuno will challenge you<br><br><ul><li> Identify, evaluate, and develop strategic partnership opportunities aligned with Yuno’s business goals</li><li> Build and maintain strong partner relationships to drive new business opportunities and increase mutual value</li><li> Assist in negotiating and structuring partnership agreements, ensuring alignment with internal policies, pricing strategy, and performance expectations</li><li> Monitor partnership KPIs and performance, delivering data-driven insights and actionable recommendations for continuous improvement</li><li> Lead and coordinate partner-focused initiatives such as co-branded events, PR campaigns, and ecosystem engagement strategies</li><li> Ensure our partners are equally promoting Yuno across their channels and networks</li><li> Collaborate closely with internal teams (Sales, Marketing, Product) to maximize the impact of each partnership<br><br><br></li></ul>🟣 The skills you need<br><br><strong>Minimum Qualifications<br><br></strong><ul><li> 7+ years of experience in partnerships, channel development, or strategic business development in fast-growing B2B SaaS or fintech companies</li><li> Strong understanding of partnership structures, negotiation dynamics, and relationship management</li><li> Proven track record of building partnerships from scratch and growing them into revenue-generating engines</li><li> Excellent communication, presentation, and influencing skills</li><li> Analytical mindset and ability to translate data into business insights</li><li> Bilingual - English<br><br><br></li></ul><strong>Preferred Qualifications<br><br></strong><ul><li> Experience in fostering a culture of high performance and collaboration</li><li> Experience in payments, enterprise SaaS, or fintech at a scale-up or global level</li><li> Fluency in other European languages (Spanish, Portuguese, French, or German)</li><li> Strong cross-functional collaboration skills</li><li> Deep understanding of the enterprise customer journey and how partnerships influence adoption and conversion<br><br><br></li></ul>🟣 What Yuno offers you<br><br><ul><li>Competitive compensation</li><li>Remote work — you can work from anywhere!</li><li>Real ownership and impact: freedom and trust to build, test, and lead from day one</li><li>Stock options</li><li>Health Plan, no matter where you are</li><li>Flexible days off</li><li>Home office bonus and work equipment</li><li>Language, professional, and personal growth courses</li><li>High impact and high velocity environment with some of the most talented and ambitious people you will ever work with</li><li>A chance to shape the story of a company and a category from the ground up</li><li>A product used by the best brands around the world<br></li></ul>","Remote, Europe, Full Time, Senior-Individual Contributor🟣 Who We AreYuno enables any company to accept all available payment methods and manage fraud detection and prevention through a single integration. Our strength is in our people, founded by a team of experts in the payments and IT industries.Yuno has built a high-performance payment orchestrator. Our technology gives companies access to top payment capabilities, allowing them to engage customers confidently and manage global business operations seamlessly.Interested in joining a fast-growing fintech company? Keep on reading and discover how your future will be with Yuno.🟣 Shape the Future of Payments in Europe (and Beyond)!We are orchestrating the best high-performing team. If you are passionate about building impactful relationships and unlocking growth through strategic alliances, this role is your opportunity to help scale a global company at the forefront of payments innovation.As a Strategic Partnerships Manager Europe, you will be at the forefront of Yuno’s growth in one of our most strategic regions. This is not just a role, it’s an opportunity to design, lead, and scale the partnerships function across a region with diverse payment ecosystems, high-growth potential, and enormous innovation opportunities.You will define and execute Yuno’s European partnership strategy, building high-impact alliances that directly drive revenue and accelerate adoption. You’ll be the primary relationship owner for strategic partners, ensuring alignment, performance, and long-term value. Your work will directly influence how businesses and consumers interact with payments across Europe and globally.🟣 Your Impact Strategic Market Building: Develop and execute Yuno’s European partnerships strategy, prioritizing markets and partner categories with the highest potential High-Value Partner Portfolio: Source, negotiate, and manage strategic alliances with payment providers, fintechs, banks, PSPs, platforms, consultancies, and technology partners Growth Acceleration: Structure partnerships that drive adoption, revenue growth, and expand Yuno’s footprint in existing and new markets Revenue-Driven Partnerships: Build partnerships that directly drive revenue through co-selling, integrations, and referrals Primary Relationship Owner: Act as the lead contact for strategic partners, ensuring alignment, performance, and long-term value on both sides Partner Enablement: Collaborate with Sales, Marketing, and Product to create partner enablement materials, GTM plays, and co-marketing efforts Cross-Functional Leadership: Work closely with Sales, Marketing, Product, and Operations to ensure partnerships deliver measurable results Market Influence: Represent Yuno at industry events to strengthen our thought leadership in European and global payments Scalability &amp; Metrics: Define success metrics and operational workflows to make partnerships scalable, repeatable, and impactful🟣 How Yuno will challenge you Identify, evaluate, and develop strategic partnership opportunities aligned with Yuno’s business goals Build and maintain strong partner relationships to drive new business opportunities and increase mutual value Assist in negotiating and structuring partnership agreements, ensuring alignment with internal policies, pricing strategy, and performance expectations Monitor partnership KPIs and performance, delivering data-driven insights and actionable recommendations for continuous improvement Lead and coordinate partner-focused initiatives such as co-branded events, PR campaigns, and ecosystem engagement strategies Ensure our partners are equally promoting Yuno across their channels and networks Collaborate closely with internal teams (Sales, Marketing, Product) to maximize the impact of each partnership🟣 The skills you needMinimum Qualifications 7+ years of experience in partnerships, channel development, or strategic business development in fast-growing B2B SaaS or fintech companies Strong understanding of partnership structures, negotiation dynamics, and relationship management Proven track record of building partnerships from scratch and growing them into revenue-generating engines Excellent communication, presentation, and influencing skills Analytical mindset and ability to translate data into business insights Bilingual - EnglishPreferred Qualifications Experience in fostering a culture of high performance and collaboration Experience in payments, enterprise SaaS, or fintech at a scale-up or global level Fluency in other European languages (Spanish, Portuguese, French, or German) Strong cross-functional collaboration skills Deep understanding of the enterprise customer journey and how partnerships influence adoption and conversion🟣 What Yuno offers youCompetitive compensationRemote work — you can work from anywhere!Real ownership and impact: freedom and trust to build, test, and lead from day oneStock optionsHealth Plan, no matter where you areFlexible days offHome office bonus and work equipmentLanguage, professional, and personal growth coursesHigh impact and high velocity environment with some of the most talented and ambitious people you will ever work withA chance to shape the story of a company and a category from the ground upA product used by the best brands around the world","Full-time","4290280023","Financial Services","https://www.linkedin.com/jobs/search/?currentJobId=4269230069&geoId=103350119&keywords=fraud%20detection&origin=JOB_SEARCH_PAGE_SEARCH_BUTTON&refresh=true","Business Development and Sales",,,,,"https://it.linkedin.com/jobs/view/strategic-partnership-manager-europe-at-yuno-4290280023?refId=wtnRS97yTSrT8%2BiWougIAQ%3D%3D&trackingId=KmbGFIoWVmprXPNOZ0J8%2FQ%3D%3D&position=16&pageNum=0","Greater Milan Metropolitan Area","2025-08-23","wtnRS97yTSrT8+iWougIAQ==","","",,"Not Applicable","Strategic Partnership Manager, Europe","KmbGFIoWVmprXPNOZ0J8/Q=="
"200","https://klarnagroup.teamtailor.com/jobs/6248814-senior-data-scientist?s=LinkedIn",,"SE","Stockholm",,"113 43","Sveavägen 46","PostalAddress","Klarna – The smarter way to shop and pay

Klarna is the AI-powered global payments and commerce network, on a mission to make shopping smarter and more flexible. Trusted by over 111 million shoppers, Klarna processes 2.9 million transactions daily, providing payment solutions that empower consumers and drive merchant growth.

With Klarna, shoppers have the freedom to pay their way—in full, later, or through financing—providing flexibility while seamlessly connecting merchants with high-intent shoppers driving conversions and customer satisfaction.

More than 790,000 merchant partners—including Uber, H&M, Saks, Sephora, Macy’s, IKEA, Expedia Group, Nike, and Airbnb—leverage Klarna’s payment options, and marketing solutions to enhance the shopping experience and build long-term customer loyalty.
From payments to personalized shopping, Klarna is shaping the future of commerce.

Klarna was founded in Stockholm, Sweden and now has offices in Stockholm, London, New York, Berlin and many more. We offer products and services to consumers and retailers within payments, social shopping, and personal finances.

Learn more at Klarna.com","4691","https://se.linkedin.com/company/klarna?trk=public_jobs_jserp-result_job-search-card-subtitle","https://media.licdn.com/dms/image/v2/D4E0BAQEKo8RSbFptLA/company-logo_100_100/company-logo_100_100/0/1706794863353/klarna_logo?e=1760572800&v=beta&t=POyyRR8Hjwf0VwAJSPo_bs_xmTu8s041aIqTih9gpLk","Klarna","The smart way to shop and pay","https://www.klarna.com/international/enterprise/","<strong>About Us<br><br></strong>With over 85 million global active users and 2,5 million transactions per day, Klarna is on the way to becoming the world’s favorite way to shop. To help us get there, we’re assembling an unparalleled global talent team—accelerating individual careers, and disrupting entire industries. We’re looking for people ready to achieve the extraordinary and embrace our bold ambitions as we shape the future of payments and fintech. Will you join us?<br><br><strong>What You'll Do<br><br></strong>End-to-End Model Ownership: Design, develop, and ship production-grade machine learning models. You will have the autonomy to own your solutions, considering everything from memory footprint to latency.<br><br>Research and Innovation: Dive deep into statistical analysis, probability, and machine learning/deep learning models. You'll be expected to critically evaluate existing solutions and, when necessary, develop novel approaches. A foundational understanding of NLP architectures like Transformers is a plus.<br><br>Engineering: Build and maintain containerized models and develop comprehensive model monitoring solutions to track metrics like variable drift.<br><br>Streamlined Deployment: Create and manage CI/CD pipelines for our machine learning models and contribute to the design and development of APIs.<br><br>Data Expertise: Utilize your SQL proficiency to perform in-depth data analysis and feature engineering.<br><br><strong>Requirements<br><br></strong>Proficient Software Engineering Skills: A strong track record of designing, developing, and deploying ML models in a production environment. Experience with deploying models on Scoring Platform is highly desirable.<br><br>Expertise: High proficiency in Python.<br><br>Strong Quantitative Foundation: A deep understanding of statistical analysis, probability, and a wide range of machine learning and deep learning models.<br><br>MLOps Experience: Hands-on experience with containerization (Docker), CI/CD pipelines, and model monitoring.<br><br>API &amp; Containers: Experience in API schema design and development and in building containerized applications (e.g., using Docker)<br><br>Excellent communication and stakeholder management skills.<br><br>Experience working with consumer or partner Fraud Detection/Credit Underwriting would be a plus.<br><br><strong>Ideally, You Have<br><br></strong>An academic background in <strong>Physics</strong>, <strong>ML</strong>, <strong>Data Science</strong>, <strong>Mathematics</strong>, or <strong>Biology<br><br></strong>Prior experience as a <strong>Senior Data Scientist</strong>, ideally within a regulated environment or fintech context<br><br>Please include a CV in English.<br><br>Since 2005, Klarna has been on a mission to reimagine how consumers spend and save in their daily lives. We help people save time and money and reduce financial worry. With over 85 million global active users and 2.5 million transactions per day, our vision is a world where Klarna empowers everyone, everywhere, through seamless financial and commerce experiences—as a personalized, trusted assistant making financial empowerment effortless.<br><br>Over 575,000 global retail partners, including H&amp;M, Saks, Sephora, Macys, IKEA, Expedia Group, and Nike have integrated Klarna's innovative technology to deliver a seamless shopping experience online and in-store.","About UsWith over 85 million global active users and 2,5 million transactions per day, Klarna is on the way to becoming the world’s favorite way to shop. To help us get there, we’re assembling an unparalleled global talent team—accelerating individual careers, and disrupting entire industries. We’re looking for people ready to achieve the extraordinary and embrace our bold ambitions as we shape the future of payments and fintech. Will you join us?What You'll DoEnd-to-End Model Ownership: Design, develop, and ship production-grade machine learning models. You will have the autonomy to own your solutions, considering everything from memory footprint to latency.Research and Innovation: Dive deep into statistical analysis, probability, and machine learning/deep learning models. You'll be expected to critically evaluate existing solutions and, when necessary, develop novel approaches. A foundational understanding of NLP architectures like Transformers is a plus.Engineering: Build and maintain containerized models and develop comprehensive model monitoring solutions to track metrics like variable drift.Streamlined Deployment: Create and manage CI/CD pipelines for our machine learning models and contribute to the design and development of APIs.Data Expertise: Utilize your SQL proficiency to perform in-depth data analysis and feature engineering.RequirementsProficient Software Engineering Skills: A strong track record of designing, developing, and deploying ML models in a production environment. Experience with deploying models on Scoring Platform is highly desirable.Expertise: High proficiency in Python.Strong Quantitative Foundation: A deep understanding of statistical analysis, probability, and a wide range of machine learning and deep learning models.MLOps Experience: Hands-on experience with containerization (Docker), CI/CD pipelines, and model monitoring.API &amp; Containers: Experience in API schema design and development and in building containerized applications (e.g., using Docker)Excellent communication and stakeholder management skills.Experience working with consumer or partner Fraud Detection/Credit Underwriting would be a plus.Ideally, You HaveAn academic background in Physics, ML, Data Science, Mathematics, or BiologyPrior experience as a Senior Data Scientist, ideally within a regulated environment or fintech contextPlease include a CV in English.Since 2005, Klarna has been on a mission to reimagine how consumers spend and save in their daily lives. We help people save time and money and reduce financial worry. With over 85 million global active users and 2.5 million transactions per day, our vision is a world where Klarna empowers everyone, everywhere, through seamless financial and commerce experiences—as a personalized, trusted assistant making financial empowerment effortless.Over 575,000 global retail partners, including H&amp;M, Saks, Sephora, Macys, IKEA, Expedia Group, and Nike have integrated Klarna's innovative technology to deliver a seamless shopping experience online and in-store.","Full-time","4276862578","IT Services and IT Consulting, Technology, Information and Internet, and Financial Services","https://www.linkedin.com/jobs/search/?currentJobId=4269230069&geoId=103350119&keywords=fraud%20detection&origin=JOB_SEARCH_PAGE_SEARCH_BUTTON&refresh=true","Design, Information Technology, and Engineering",,,,,"https://it.linkedin.com/jobs/view/senior-data-scientist-at-klarna-4276862578?refId=wtnRS97yTSrT8%2BiWougIAQ%3D%3D&trackingId=Pmxqj1eiTDrlSx6bB4L6LA%3D%3D&position=15&pageNum=0","Milan, Lombardy, Italy","2025-08-13","wtnRS97yTSrT8+iWougIAQ==","","€63,236.00","€90,429.00","Mid-Senior level","Senior Data Scientist","Pmxqj1eiTDrlSx6bB4L6LA=="
